Polling Station No.,Building,Polling Areas
188,Panchayat Union Elementary School Vethiripatti 622103,"1) Vellanjar (R.V) Vellanjar (P), Ward-2 Vathiripatti,2) Vellanjar (R.V) Vellanjar (P), Ward-2 Malavarayanpatti,3) Vellanjar (R.V) Vellanjar (P), Ward-2 Solayampatti,4) Vellanjar (R.V) Vellanjar (P), Ward-2 OOranikulam,5) Vellanjar (R.V) Vellanjar (P), Ward-2 Veppavayal,6) Vellanjar (R.V) Vellanjar (P), Ward-2 Vadakki kalam,999) OVERSEAS ELECTORS, OVERSEAS ELECTORS"
189,"Government Higher Secondary School, Main Building, West Portion Annavasal 622101","1) Annavasal (R.V) Annavasal (SP), Ward-1 1- st Idayar Theru,2) Annavasal (R.V) Annavasal (SP), Ward-1 2- nd Idayar Theru,3) Annavasal (R.V) Annavasal (SP), Ward-2, 3- rd Idayar Theru,4) Annavasal (R.V) Annavasal (SP), Ward-1 Vadakadu,5) Annavasal (R.V) Annavasal (SP), Ward-3 Maruthuva Theru,6) Annavasal (R.V) Annavasal (SP), Ward-4 Pattanamkattubava Ravuther Theru,999) OVERSEAS ELECTORS, OVERSEAS ELECTORS"
190,"Government Higher Secondary School, East Building, West Facing, Annavasal 622101","1) Annavasal (R.V) Annavasal (SP), Ward-7 Thulukka Oorani,2) Annavasal (R.V) Annavasal (SP), Ward-16 Viralimalai Salai,3) Annavasal (R.V) Annavasal (SP), Ward-4 Pattani Pallivasal Theru,4) Annavasal (R.V) Annavasal (SP), Ward-4 Palaya kadai Theru,5) Annavasal (R.V) Annavasal (SP), Ward-4 Keeranur salai,6) Annavasal (R.V) Annavasal (SP), Ward-4 Pathima Colony,7) Annavasal (R.V) Annavasal (SP), Ward-4 Sekkadi,8) Annavasal (R.V) Annavasal (SP), Ward-5 Maithana Theru,9) Annavasal (R.V) Annavasal (SP), Ward-5 Mathakovil Theru,10) Annavasal (R.V) Annavasal (SP), Ward-5 Harijan Theru,999) OVERSEAS ELECTORS, OVERSEAS ELECTORS"
191,"Government Higher Secondary School, East Building, West Faching, North Portion Annavasal 622101","1) Annavasal (R.V) Annavasal (SP), Ward-6 Nallammal Chatram Salai,2) Annavasal (R.V) Annavasal (SP), Ward-7 Pudu theru -1,3) Annavasal (R.V) Annavasal (SP), Ward-7 Harijana theru - 1,4) Annavasal (R.V) Annavasal (SP), Ward-6 Viralimalai road,5) Annavasal (R.V) Annavasal (SP), Ward-7 Bahavathi Amman Koviltheru.,6) Annavasal (R.V) Annavasal (SP), Ward-7 Harijana theru-2,7) Annavasal (R.V) Annavasal (SP), Ward-7 Thulukkan Oorani Theru,8) Annavasal (R.V) Annavasal (SP), Ward-3 Keelaratha Veethi,9) Annavasal (R.V) Annavasal (SP), Ward-7 Sivankovil Therkku,999) OVERSEAS ELECTORS, OVERSEAS ELECTORS"
192,"Government Higher Secondary School, Main Building, East Portion, Annavasal 622101","1) Annavasal (R.V) Annavasal (SP), Ward-3 Sannathi Veethi,2) Annavasal (R.V) Annavasal (SP), Ward-2 Muthuraja Theru,3) Annavasal (R.V) Annavasal (SP), Ward-3 Keeranur Salai,4) Annavasal (R.V) Annavasal (SP), Ward-3 Kuyavar Theru,5) Annavasal (R.V) Annavasal (SP), Ward-6 Golden Nagar -1,6) Annavasal (R.V) Annavasal (SP), Ward-6 Golden Nagar -2,7) Annavasal (R.V) Annavasal (SP), Ward-6 Golden Nagar - 3,8) Annavasal (R.V) Annavasal (SP), Ward-6 Golden Nagar -4,9) Annavasal (R.V) Annavasal (SP), Ward-6 Bazheer Nagar,10) Annavasal (R.V) Annavasal (SP), Ward-7 Pudutheru -2,999) OVERSEAS ELECTORS, OVERSEAS ELECTORS"
193,"Panchayat Union Elementary School New Terraced Building, West Portion, North Facing, Annavasal 622101","1) Annavasal (R.V) Annavasal (SP), Ward-10 Harijanatheru 3-rd Veethi,2) Annavasal (R.V) Annavasal (SP), Ward-9 Harijanatheru 4-th Veethi,3) Annavasal (R.V) Annavasal (SP), Ward-9 Harijanatheru 5-th Veethi,4) Annavasal (R.V) Annavasal (SP), Ward-9 Harijanatheru 6-th Veethi,999) OVERSEAS ELECTORS, OVERSEAS ELECTORS"
194,"Panchayat Union Elementary School, New Terraced Building, Middle Portion, North Facing, Annavasal 622101","1) Annavasal (R.V) Annavasal (SP), Ward-9 Colonytheru,2) Annavasal (R.V) Annavasal (SP), Ward-11 Kodikal Theru,3) Annavasal (R.V) Annavasal (SP), Ward-10 Viralimalai Road,999) OVERSEAS ELECTORS, OVERSEAS ELECTORS"
195,"Panchayat Union Elementary School, New Terraced Building, East Portion North Facing, Annavasal 622101","1) Annavasal (R.V) Annavasal (SP), Ward-8 Harijantheru -3,2) Annavasal (R.V) Annavasal (SP), Ward-8 Harijantheru -2,3) Annavasal (R.V) Annavasal (SP), Ward-8 Bahavathi Amman Theru,4) Annavasal (R.V) Annavasal (SP), Ward-10 Palaya Hospital Road,5) Annavasal (R.V) Annavasal (SP), Ward-10 Pattanamkattubava Rawther Theru,6) Annavasal (R.V) Annavasal (SP), Ward-10 Sannathi Veethi,7) Annavasal (R.V) Annavasal (SP), Ward-10 Natharkan Veethi,8) Annavasal (R.V) Annavasal (SP), Ward-10 Viralimalai Salai,9) Annavasal (R.V) Annavasal (SP), Ward-11 Pattani Pallivasaltheru,999) OVERSEAS ELECTORS, OVERSEAS ELECTORS"
196,"Panchayat Union Elementary School, New Terraced Building, Eastern Portion Annavasal 622101","1) Annavasal (R.V) Annavasal (SP), Ward-11 Palayakadai Veethi,2) Annavasal (R.V) Annavasal (SP), Ward-11 Kasappukadai Veethi,3) Annavasal (R.V) Annavasal (SP), Ward-11 Palayaperumalkovil Theru,4) Annavasal (R.V) Annavasal (SP), Ward-12 Kammala Theru,5) Annavasal (R.V) Annavasal (SP), Ward-13 Kunjanvayal,6) Annavasal (R.V) Annavasal (SP), Ward-13 Chinnasengapatti,7) Annavasal (R.V) Annavasal (SP), Ward-13 Nallan vayal,999) OVERSEAS ELECTORS, OVERSEAS ELECTORS"
197,"Panchayat Union Middle School, D.P.E.P. BUILDING NORTH WESTERN SIDE Chittannavasal 622101","1) Chithannavasal (R.V) Chithannavasal (P), Ward-1 Chithannavasal Vadakku Paguthi,2) Chithannavasal (R.V) Chithannavasal (P), Ward-2 Chithannavasal Therkku Paguthi,999) OVERSEAS ELECTORS, OVERSEAS ELECTORS"
198,"Panchayat Union Middle School, East Portion, North Facing, Chittannavasal 622101","1) Chithannavasal (R.V) Chithannavasal (P), Ward-3 Nallammal Chatram,999) OVERSEAS ELECTORS, OVERSEAS ELECTORS"
199,"Panchayat Union Primary School, South Terraced Building, North Faching Mathiyanallur 622101","1) Mathiyanallur (R.V) Mathiyanallur (P), Ward-1 Adidravidar (Pallar) Colony,2) Mathiyanallur (R.V) Mathiyanallur (P), Ward-1 Adidravidar (Parayar) Colony,3) Mathiyanallur (R.V) Mathiyanallur (P), Ward-1 Mathiyanallur,4) Mathiyanallur (R.V) Mathiyanallur (P), Ward-2 Kallampatti,5) Mathiyanallur (R.V) Mathiyanallur (P), Ward-2 Ellayapatti,6) Mathiyanallur (R.V) Mathiyanallur (P), Ward-2 Chokkanathanpatti,7) Mathiyanallur (R.V) Mathiyanallur (P), Ward-2 Kalaikurichivayal,999) OVERSEAS ELECTORS, OVERSEAS ELECTORS"
200,"Panchayat Union Elementary School, East Portion, North Facing, Tiled Building, Maruthandalai 622101","1) Panampatti (R.V) Panampatti (P), Ward-1 Panampatti,2) Panampatti (R.V) Panampatti (P), Ward-1 Karayanpatti,999) OVERSEAS ELECTORS, OVERSEAS ELECTORS"
201,"Panchayat Union Elementary School, West Portion, North Facing, Tiled Building, Maruthandalai 622101","1) Panampatti (R.V) Panampatti (P), Ward-2 Maruthanthalai,2) Panampatti (R.V) Panampatti (P), Ward-3 Manikkampatti,3) Panampatti (R.V) Panampatti (P), Ward-3 Vagaipatti,4) Panampatti (R.V) Panampatti (P), Ward-3 Katheripatti,5) Panampatti (R.V) Panampatti (P), Ward-3 Pidarampatti,999) OVERSEAS ELECTORS, OVERSEAS ELECTORS"
202,"Adidravidar Welfare Elementary school, Kurukkalaiyapatti 622002","1) Thiruvengaivasal(R.V) Thiruvengaivasal(P), Ward-6 Kurukkailayapatti,2) Thiruvengaivasal(R.V) Thiruvengaivasal(P), Ward-6 Sellukudi kovundar Theru,999) OVERSEAS ELECTORS, OVERSEAS ELECTORS"
203,"Panchayat Union Elementary School, Chellukudi-622002","1) Thiruvengaivasal(R.V) Thiruvengaivasal(P), Ward-6 Sellukudi Vadakkutheru,2) Thiruvengaivasal(R.V) Thiruvengaivasal(P), Ward-4 Sellukudi Adidiravidar Theru,3) Thiruvengaivasal(R.V) Thiruvengaivasal(P), Ward- 4 S e l l u ku di Th e rkku t h e ru , 4 ) Thiruvengaivasal(R.V) Thiruvengaivasal(P), Ward-4 Kilapatti,5) Thiruvengaivasal(R.V) Thiruvengaivasal(P), Ward-5 Konavayal,6) Thiruvengaivasal(R.V) Thiruvengaivasal(P), Ward-6 Sirunjunai Vadakkutheru,7) Thiruvengaivasal(R.V) Thiruvengaivasal(P), Ward-6 Sirunjunai AdidravidarTherkkutheru,999) OVERSEAS ELECTORS, OVERSEAS ELECTORS"
204,"Panchayat Union Middle School , West Terraced Building, East Faching Perunjunai 622002","1) Perunjunai (R.V) Thiruvengaivasal(P), Ward-1 Perunjunai Adidravidar Kilakkutheru,2) Perunjunai (R.V) Thiruvengaivasal(P), Ward-1 Perunjunai Adidravidar Merkutheru,3) Perunjunai (R.V) Thiruvengaivasal(P), Ward-1 Perunjunai B.C. Theru,4) Perunjunai (R.V) Thiruvengaivasal(P), Ward-1 Perunjunai B.C. Kovundartheru,5) Thiruvengaivasal(R.V) Thiruvengaivasal(P), Ward-2 Thiruvengai Vasal S.C Theru,999) OVERSEAS ELECTORS, OVERSEAS ELECTORS"
205,"Panchayat Union Elementary School, Annathurani Ayinkudi- 622002","1) Thiruvengaivasal(R.V) Thiruvengaivasal(P), Ward-2 Thiruvengai Vasal B.C.Theru,2) Thiruvengaivasal(R.V) Thiruvengaivasal(P), Ward-2 Valayanvayal,3) Ayingudi (R.V) Thiruvengaivasal(P), Ward-3 Annathoorani,4) Ayingudi (R.V) Thiruvengaivasal(P), Ward-3 S.C Vadamalapur S.C.Theru,5) Ayingudi (R.V) Thiruvengaivasal(P), Ward-3 Vadamalappur B.C .Theru,6) Ayingudi (R.V) Thiruvengaivasal(P), Ward-3 Nilayavayal,7) Ayingudi (R.V) Thiruvengaivasal(P), Ward-3 Kurukkalayapatti,999) OVERSEAS ELECTORS, OVERSEAS ELECTORS"
206,"Panchayat Union Elementary School, New Terraced Building, North Facing, Marayapatti 622104","1) Marayapatti(R.V) Thiruvengaivasal(P), Ward-7 Uyyakudipatti,2) Marayapatti(R.V) Thiruvengaivasal(P), Ward-7 Velankudipatti,3) Marayapatti(R.V) Thiruvengaivasal(P), Ward-7 Marayapatti,999) OVERSEAS ELECTORS, OVERSEAS ELECTORS"
207,"Panchayat Union Middle School, NEW TERRACED BUILDING Mettupatti 622104","1) Marayapatti(R.V) Thiruvengaivasal(P), Ward-8 Mettupatti,2) Marayapatti(R.V) Thiruvengaivasal(P), Ward-8 Andipatti,999) OVERSEAS ELECTORS, OVERSEAS ELECTORS"
208,"Panchayat Union Elementary School, NEW TERRACED BUILDING Ariyur 622101","1) Ariyur (R.V) Ariyur (P), Ward-1 Ariyur,2) Ariyur (R.V) Ariyur (P), Ward-1 Adidravidar Kudiyeruppu,3) Ariyur (R.V) Ariyur (P), Ward-1 Alagapuri,4) Ariyur (R.V) Ariyur (P), Ward-1 Ambethkar Nagar,5) Ariyur (R.V) Ariyur (P), Ward-1 Puduvayal,999) OVERSEAS ELECTORS, OVERSEAS ELECTORS"
209,"Panchayat Union Elementary School, North Facing, Mannavelampatti 622101","1) Panangudi(R.V) Mannavelampatti (P), Ward-1 Panangudi,2) Mangudi(R.V) Mannavelampatti (P), Ward -1 Mannavelampatti Kilakku,3) Mangudi(R.V) Mannavelampatti (P), Ward-2 Mannavelampatti Therkku,999) OVERSEAS ELECTORS, OVERSEAS ELECTORS"
210,"Panchayat Union Elementary School, South side, North Facing Mannavelampatti 622101","1) Mangudi(R.V) Mannavelampatti (P), Ward- 2 Mannavelampatti Vadakku,2) Mangudi(R.V) Mannavelampatti (P), Ward- 2 Ayipatti Vadakku,3) Mangudi(R.V) Mannavelampatti (P), Ward-3 Ayipatti Therkku,4) Mangudi(R.V) Mannavelampatti (P), Ward-3 Keela Agarapatti,999) OVERSEAS ELECTORS, OVERSEAS ELECTORS"
211,Panchayat Union Elementary School Thachampatti 622101,"1) Thachampatti (R.V) Thachampatti (P), Ward-1 Vadakkipatti,2) Thachampatti (R.V) Thachampatti (P), Ward-1 Thachampatti,3) Thachampatti (R.V) Thachampatti (P), Ward-1 Therkku Thachampatti,4) Thachampatti (R.V) Thachampatti (P), Ward-2 Nadupatti,5) Thachampatti (R.V) Thachampatti (P), Ward-2 Kambalakadu,999) OVERSEAS ELECTORS, OVERSEAS ELECTORS"
212,"Panchayat Union Elementary School, Tiled Building Pudur 622103","1) Pudur (R.V) Pudur (P), Ward-1 Pudur,2) Pudur (R.V) Pudur (P), Ward-1 Athampatti,3) Pudur (R.V) Pudur (P), Ward-1 Pudur Colony,4) Pudur (R.V) Pudur (P), Ward-3 Kattuppatti (Kilakku),999) OVERSEAS ELECTORS, OVERSEAS ELECTORS"
213,"Panchayat Union Elementary School, New Building, East Facing Pudur 622103","1) Pudur (R.V) Pudur (P), Ward-3 kattuppatti (Merku),2) Pudur (R.V) Pudur (P), Ward-2 Kulavaippatti,999) OVERSEAS ELECTORS, OVERSEAS ELECTORS"
214,"Government High School, Old Building, South Side, West Portion, Mukkannamalaipatti 622103","1) Veerapatti (R.V) Mukkanamalaipatti (P), Ward-1 Pulavanpatti,2) Veerapatti (R.V) Mukkanamalaipatti (P), Ward-2 Madakoil,3) Veerapatti (R.V) Mukkanamalaipatti (P), Ward-1 Velampatti,4) Veerapatti (R.V) Mukkanamalaipatti (P), Ward-1 Mukkanamalaipatti Kilakku,999) OVERSEAS ELECTORS, OVERSEAS ELECTORS"
215,"Government High School, Old Building, South Side, East Portion, Mukkannamalaipatti 622103","1) Veerapatti (R.V) Mukkanamalaipatti (P), Ward-2 Mukkanamalaipatti Vadakku,999) OVERSEAS ELECTORS, OVERSEAS ELECTORS"
216,"Government High School, Old Building, North Side, East Mukkannamalaipatti 622103","1) Veerapatti (R.V) Mukkanamalaipatti (P), Ward-3 Mukkanamalaipatti Nadutheru,Therkkutheru,999) OVERSEAS ELECTORS, OVERSEAS ELECTORS"
217,"Government High School, Old Building, North Side, West Portion, Mukkannamalaipatti 622103","1) Veerapatti (R.V) Mukkanamalaipatti (P), Ward-4 Pallivasal Theru,Padayachi theru,2) Veerapatti (R.V) Mukkanamalaipatti (P), Ward-4 Mettupatti,3) Veerapatti (R.V) Mukkanamalaipatti (P), Ward-4 Velankulam,999) OVERSEAS ELECTORS, OVERSEAS ELECTORS"
218,"Panchayat Union Middle School, Veerapatti 622103","1) Veerapatti (R.V) Veerapatti (P), Ward-1 Veerapatti,2) Veerapatti (R.V) Veerapatti (P), Ward-1 Mettukalam,999) OVERSEAS ELECTORS, OVERSEAS ELECTORS"
219,"Panchayat Union Middle School, North faching, East Building, Veerapatti 622103","1) Veerapatti (R.V) Veerapatti (P), Ward-1 Sennappanayakkanpatti,2) Veerapatti (R.V) Veerapatti (P), Ward-1 Vavvaneri,3) Veerapatti (R.V) Veerapatti (P), Ward-1 Poikadipatti,999) OVERSEAS ELECTORS, OVERSEAS ELECTORS"
220,"Panchayat Union Middle School, North Faching, Terraced Building, Kaladippatti-622103 Veerapatti 622103","1) Veerapatti (R.V) Veerapatti (P), Ward-2 Kaladipatti,2) Veerapatti (R.V) Veerapatti (P), Ward-2 Therkukalam,3) Veerapatti (R.V) Veerapatti (P), Ward-2 Kaladipatti chatram,999) OVERSEAS ELECTORS, OVERSEAS ELECTORS"
221,"Panchayat Union Middle School, West Facing , North portion, Idayapatti 621316","1) Idayapatti (R.V) Idayapatti (P), Ward-1 Veliyangudi,2) Idayapatti (R.V) Idayapatti (P), Ward-1 Pothaiyampatti,3) Idayapatti (R.V) Idayapatti (P), Ward-2 Kurumbatheru,4) VIdayapatti (R.V) Idayapatti (P), Ward-2 Kasiyapuram,5) VIdayapatti (R.V) Idayapatti (P), Ward-2 Idayapatti,6) Idayapatti (R.V) Idayapatti (P), Ward-2 Velankadu,999) OVERSEAS ELECTORS, OVERSEAS ELECTORS"
222,"Panchayat Union Middle School, West Facing , South portion, Idayapatti 621316","1) Idayapatti (R.V) Idayapatti (P), Ward-2 Chinna Koovattupatti,2) Idayapatti (R.V) Idayapatti (P), Ward-3 Koovattupatti Harijantheru,3) Idayapatti (R.V) Idayapatti (P), Ward-3 Koovattupatti Kilakku,4) Idayapatti (R.V) Idayapatti (P), Ward-3 Koovattupatti Merku,5) Idayapatti (R.V) Idayapatti (P), Ward-4 Koovattupatti Ambalakarar Theru,6) Idayapatti (R.V) Idayapatti (P), Ward-4 karampatti,999) OVERSEAS ELECTORS, OVERSEAS ELECTORS"
223,"Panchayat Union Middle School, NEW TERRACED BUILDING Alathur 622102","1) Alathur (R.V) Alathur (P), Ward-1 kurichipatti Vadakku Theru,2) Alathur (R.V) Alathur (P), Ward-2 Kurichipatti Therkkutheru,3) Alathur (R.V) Alathur (P), Ward-1 Alathur Palaya Adidravidar Kudiyeruppu,4) Alathur (R.V) Alathur (P), Ward-1 Alathur Merku,999) OVERSEAS ELECTORS, OVERSEAS ELECTORS"
224,"Panchayat Union Middle School, North Face ,West Portion Alathur 622102","1) Alathur (R.V) Alathur (P), Ward-1 Alathur Kilakku,2) Alathur (R.V) Alathur (P), Ward-1 Alathur Puthiya Adidravidar Colony,3) Alathur (R.V) Alathur (P), Ward-2 Kanchiranpatti,4) Alathur (R.V) Alathur (P), Ward-2 Chokkanpatti,999) OVERSEAS ELECTORS, OVERSEAS ELECTORS"
225,"Panchayat Union Middle School, New Terraced Building North Portion, West Facing, Kadavampatti 622102","1) Kathavampatti (p), Ward-1 kadavampati,2) Kathavampatti (P), Ward-2 Soriyampatti,3) Kathavampatti (P), Ward-2 Neivaipatti,4) Kathavampatti (P), Ward-2 Thirunadu Kilakku,5) Thalinji (RV) Thalinji (P), Ward-2 Thirunadu Merku,999) OVERSEAS ELECTORS, OVERSEAS ELECTORS"
226,"Panchayat Union Elementary School, New Terraced Building, North Portion, East Facing Thalinji 622102","1) Thalinji (RV) Thalinji (P), Ward-3 Thalinji,2) Thalinji (RV) Thalinji(P), Ward-3 Keelapatti,3) Thalinji (RV) Thalinji (P), Ward-3 Melapatti,4) Thalinji (RV) Thalinji (P), Ward-3 Ariyakonpatti,5) Thalinji (RV) Thalinji (P), Ward-3 Solagampatti,6) Thalinji (RV) Thalinji (P), Ward-3 OOthukadu,7) Thalinji (RV) Thalinji (P), Ward-3 Itchangudi,999) OVERSEAS ELECTORS, OVERSEAS ELECTORS"
227,"Government High School, SSA Building, South Facing, West Portion Kilikudi 622102","1) Gudalur(R.V) Kilikudi (P), Ward-1 Ellaipatti,2) Gudalur(R.V) Kilikudi (P), Ward-41 Perumalpatti,3) Gudalur(R.V) Kilikudi (P), Ward-1 Koodalur,999) OVERSEAS ELECTORS, OVERSEAS ELECTORS"
228,Panchayat Union Elementary School Peyal 622102,"1) Peyal(R.V) Kilikudi (P), Ward-4 Valayapatti,2) Peyal(R.V) Kilikudi (P), Ward-4 Vairampatti,3) Peyal(R.V) Kilikudi (P), Ward-4 Peyal,999) OVERSEAS ELECTORS, OVERSEAS ELECTORS"
229,"Panchayat Union Elemenrary School, Tiled Building, North Faching Kilikudi 622102","1) Mampatti(R.V) Kilikudi (P), Ward-1 Chokkampatti,2) Mampatti(R.V) Kilikudi (P), Ward-2 Seethapatti,3) Mampatti(R.V) Kilikudi (P), Ward-2 Solaicheripartti,4) Mampatti(R.V) Kilikudi (P), Ward-2 Mampatti,5) Mampatti(R.V) Kilikudi (P), Ward-3 Konakurichipatti,999) OVERSEAS ELECTORS, OVERSEAS ELECTORS"
230,"Government High School, SSA Building, South Facing, East Portion Kilikudi 622102","1) Kilikudi (R.V) Kilikudi (P), Ward-2 Veppanganipatti,2) Kilikudi (R.V) Kilikudi (P), Ward-2 Vilavayal Colony,3) Kilikudi (R.V) Kilikudi (P), Ward-2 Villampatti,4) Kilikudi (R.V) Kilikudi (P), Ward- 5 Kilikudi,5) Kilikudi (R.V) Kilikudi (P), Ward-5 Chettiyapatti,999) OVERSEAS ELECTORS, OVERSEAS ELECTORS"
231,"Government Higher Secondary School , New Terraced Building,West Facing, North portion Parambur 622104","1) Parambur (R.V) Parambur (P), Ward-2 Parambur Vadakku,999) OVERSEAS ELECTORS, OVERSEAS ELECTORS"
232,Panchayat Union Elementary School Karasoorampatti 622104,"1) Oonaiyur (P), Ward-2 Kappakudi,2) Vannarapatti (R.V) Parambur (P), Ward-2 Vannarapatti,3) Vannarapatti (R.V) Parambur (P), Ward-3 Pudupatti,4) Vannarapatti (R.V) Parambur (P), Ward-3 Karasooranpatti,5) Kavinaripatti(R.V) Oonaiyur (P), Ward-2 Kavinaripatti,6) Kavinaripatti(R.V) Oonaiyur (P), Ward-2 Perichikudipatti,7) Puthakudi(R.V) Oonaiyur (P), Ward-2 Puthakudi,999) OVERSEAS ELECTORS, OVERSEAS ELECTORS"
233,"Government Higher Secondary School, New Terraced Building, Middle Portion West Facing, South Building Parambur 622002","1) Parambur (R.V) Parambur (P), Ward-4 Parambur Keelpagam,2) Parambur (R.V) Parambur (P), Ward-3 Mettupatti,3) Parambur (R.V) Parambur (P), Ward-2 Kunniyapatti,4) Parambur (R.V) Parambur (P), Ward-2 Poolampatti,5) Parambur (R.V) Parambur (P), Ward-2 Vettukadu,6) Parambur (R.V) Parambur (P), Ward-3 Kallampatti Senthankarai,999) OVERSEAS ELECTORS, OVERSEAS ELECTORS"
234,"Government Higher Secondary School New Terraced Building , West facing, South Portion, Parambur 622104","1) Parambur (R.V) Parambur (P), Ward-5 Puliyampatti,2) Parambur (R.V) Parambur (P), Ward-5 Veeraperumalpatti,3) Pinnangudi(R.V) Parambur (P), Ward-3 Anaipatti,4) Pinnangudi(R.V) Parambur (P), Ward-3 Seegampatti,5) Pinnangudi(R.V) Parambur (P), Ward-3 Pinnangudi,999) OVERSEAS ELECTORS, OVERSEAS ELECTORS"
235,"Panchayat Union Elementary School, New Terraced Building, East Facing South Portion Parambur 622104","1) Parambur (R.V) Parambur (P), Ward-4 Parambur Therkku,999) OVERSEAS ELECTORS, OVERSEAS ELECTORS"
236,"Government Higher Secondary School, West Portion, South Facing Parambur 622104","1) Parambur (R.V) Parambur (P), Ward-4 Panampatti Therkku,2) Parambur (R.V) Parambur (P), Ward-4 Panampatti Vadakku,999) OVERSEAS ELECTORS, OVERSEAS ELECTORS"
237,"Panchayat Union Elementary School, NEW SSA BUILDING., WESTERN SIDE Kadambarayanpatti 622104","1) Kadambarayanpatti (R.V) Parambur (P), Ward-1 Kadambarayanpatti Merku,2) Kadambarayanpatti (R.V) Parambur (P), Ward-1 Kadambarayanpatti Kilakku,3) Kadambarayanpatti (R.V) Parambur (P), Ward-1 Usilampatti,4) Kadambarayanpatti (R.V) Parambur (P), Ward-1 Solaicheripatti,5) Kadambarayanpatti (R.V) Parambur (P), Ward-1 Kanniyapatti,6) Kadambarayanpatti (R.V) Parambur (P), Ward-1 Rayapatti (Thalampatti),999) OVERSEAS ELECTORS, OVERSEAS ELECTORS"
238,"Government High School, North Faching Terraced Building, Middle Portion Kudumiyanmalai 622104","1) Kudumiyanmalai (R.V) Kudumiyanmalai (P), Ward-1 Aariyamuthupatti,2) Kudumiyanmalai (R.V) Kudumiyanmalai (P), Ward-1 Marungipatti,3) Kudumiyanmalai (R.V) Kudumiyanmalai (P), Ward-1 Keelaparaikalam,4) Kudumiyanmalai (R.V) Kudumiyanmalai (P), Ward-1 Urugampatti,999) OVERSEAS ELECTORS, OVERSEAS ELECTORS"
239,"Panchayat Union Elementary School,South Facing, West Portion, Kudumiyanmalai 622104","1) Kudumiyanmalai (R.V) Kudumiyanmalai (P), Ward-2 Kudumiyanmalai Vadapagam,2) Kudumiyanmalai (R.V) Kudumiyanmalai (P), Ward-3 Anna Nagar,3) Kudumiyanmalai (R.V) Kudumiyanmalai (P), Ward-3 Visalikalam,999) OVERSEAS ELECTORS, OVERSEAS ELECTORS"
240,"Panchayat Union Elementary School,North Portion, East Facing Kudumiyanmalai 622104","1) Kudumiyanmalai (R.V) Kudumiyanmalai (P), Ward-2 Kudimiyanmalai Thenpagam,2) Kudumiyanmalai (R.V) Kudumiyanmalai (P), Ward-3 Ochapatti,3) Kudumiyanmalai (R.V) Kudumiyanmalai (P), Ward-3 Melaparaikalam,4) Kudumiyanmalai (R.V) Kudumiyanmalai (P), Ward-3 Puramalai,5) Kudumiyanmalai (R.V) Kudumiyanmalai (P), Ward-3 Uppuparai (Seegampatti),999) OVERSEAS ELECTORS, OVERSEAS ELECTORS"
241,"Panchayat Union Elemenrary School, Terraced Building, East Faching, South Portion Visalur 622104","1) Visalur (R.V) Kudumiyanmalai (P), Ward-3 Eluvichipatti,2) Visalur (R.V) Kudumiyanmalai (P), Ward-3 Visalur,999) OVERSEAS ELECTORS, OVERSEAS ELECTORS"
242,"Government Higher Secondary School, North Facing, East Portion Vayalogam 622104","1) Vayalogam (R.V) Vayalogam (P), Ward-1 Panankadu,2) Vayalogam (R.V) Vayalogam (P), Ward-1 Keelakalam,3) Vayalogam (R.V) Vayalogam (P), Ward-1 Agarapatti,4) Vayalogam (R.V) Vayalogam (P), Ward-1 Annapannai,5) Vayalogam (R.V) Vayalogam (P), Ward-3 Vayalogam Therkku,999) OVERSEAS ELECTORS, OVERSEAS ELECTORS"
243,"Government Higher Secondary School, North Facing, Middle Portion Vayalogam 622104","1) Vayalogam (R.V) Vayalogam (P), Ward-2 Kanattampatti,2) Vayalogam (R.V) Vayalogam (P), Ward-2 Velampatti,3) Vayalogam (R.V) Vayalogam (P), Ward-2 Muthalipatti,999) OVERSEAS ELECTORS, OVERSEAS ELECTORS"
244,"Government Higher Secondary School, North Facing, West Middle Portion Vayalogam 622104","1) Vayalogam (R.V) Vayalogam (P), Ward-2 Vayalogam Keelpagam,2) Vayalogam (R.V) Vayalogam (P), Ward-3 Vayalogam Vadakkupaguthi,999) OVERSEAS ELECTORS, OVERSEAS ELECTORS"
245,"Panchayat Union Middle School, South Faching North Portion Mangudi 622101","1) Mangudi (R.V) Mangudi (P), Ward-1 Velar Theru, Muslim theru,2) Mangudi (R.V) Mangudi (P), Ward-1 Adidravidar Theru,999) OVERSEAS ELECTORS, OVERSEAS ELECTORS"
246,"Panchayat Union Middle School, West Faching East Portion Mangudi 622101","1) Mangudi (R.V) Mangudi (P), Ward-2 Mangudi Therkku,2) Mangudi (R.V) Mangudi (P), Ward-2 Mangudi Vadakku,3) Mangudi (R.V) Mangudi (P), KWard-1 Kannattampatti,999) OVERSEAS ELECTORS, OVERSEAS ELECTORS"
247,"Panchayat Union Elementary School, East Facing, Perumanadu 622104","1) Perumanadu (R.V) Perumanadu (P), Ward-1,3 Perumanadu,999) OVERSEAS ELECTORS, OVERSEAS ELECTORS"
248,"Panchayat Union Elementary School, South Facing West Side, Perumanadu 622104","1) Perumanadu (R.V) Perumanadu (P), Ward-1,3 Perumanadu,999) OVERSEAS ELECTORS, OVERSEAS ELECTORS"
249,"Government High School, New Terraced Building, West Faching, East Portion, Perumanadu 622104","1) Perumanadu (R.V) Perumanadu (P), Ward-1, Pudukilapatti,2) Perumanadu (R.V) Perumanadu (P), Ward-2 Mailapatti,3) Perumanadu (R.V) Perumanadu (P), Ward-2 Melapaluvanji,999) OVERSEAS ELECTORS, OVERSEAS ELECTORS"
250,"Government High School ,Terracced Building, South Facing Pulvayal 622104","1) Pulvayal (R.V) Pulvayal (P), Ward-1 Kandupatti,2) Pulvayal (R.V) Pulvayal (P), Ward-1 Alavayal,3) Pulvayal (R.V) Pulvayal (P), Ward-1 Kollampatti,4) Pulvayal (R.V) Pulvayal (P), Ward-2 Sandapatti,999) OVERSEAS ELECTORS, OVERSEAS ELECTORS"
251,"Panchayat Union Elementary School, west Faching, East Portion Pulvayal 622104","1) Pulvayal (R.V) Pulvayal (P), Ward-2 Pulvayal,999) OVERSEAS ELECTORS, OVERSEAS ELECTORS"
252,Panchayat Union Elementary School Sundarapatti 622104,"1) Sundarapatti(R.V) Pulvayal (P), Ward-3 Mappilaiapatti,2) Sundarapatti(R.V) Pulvayal (P), Ward-3 Thiruvalluvar Nagar,3) Sundarapatti(R.V) Pulvayal (P), Ward-3 Thethinapatti,4) Sundarapatti(R.V) Pulvayal (P), Ward-3 Nerigipatti,5) Sundarapatti(R.V) Pulvayal (P), Ward-3 Kamaraj Nagar,6) Sundarapatti(R.V) Pulvayal (P), Ward-3 Pillayapatti,7) Sundarapatti(R.V) Pulvayal (P), Ward-3 Sundarapatti,8) Sundarapatti(R.V) Pulvayal (P), Ward-8 Annai Nagar,9) Sundarapatti(R.V) Pulvayal (P), Ward-3 Kadayapatti,999) OVERSEAS ELECTORS, OVERSEAS ELECTORS"
253,"Panchayat Union Elementary School, NEW TERRACED BUILDING Nilaiyapatti 622104","1) Pulvayal (R.V) Pulvayal (P), Ward-4 Pakkuruchipatti,2) Pulvayal (R.V) Pulvayal (P), Ward-4 Nilayapatti,999) OVERSEAS ELECTORS, OVERSEAS ELECTORS"
254,"Panchayat Union Elementary School, NEW TERRACED BUILDING Senthamangalam 622104","1) Gothandaramapuram (R.V) Gothandaramapuram (P), Ward-1 Keelapaluvanji,2) Gothandaramapuram (R.V) Gothandaramapuram (P), Ward-2 Senthamangalam,999) OVERSEAS ELECTORS, OVERSEAS ELECTORS"
255,"Panchayat Union Elementary School, Murugarajnagar 622104","1) Gothandaramapuram (R.V) Gothandaramapuram (P), Ward-3 Kilapatti,2) Gothandaramapuram (R.V) Gothandaramapuram (P), Ward-3 Kunnakudipatti,3) Kurukkapatti(R.V) Gothandaramapuram (P), Ward-3 Kurukkapatti,4) Gothandaramapuram (R.V) Gothandaramapuram (P), Ward-3 Murugaraj Nagar,999) OVERSEAS ELECTORS, OVERSEAS ELECTORS"
