Polling Station No.,Building,Polling Areas
258,Mattaparai,GOVT HIGHER SEC SCHOOL NEW BUILDING EAST PORTION MATTAPARAI - 624213
259,Mattaparai,GOVT HIGHER SEC SCHOOL WEST BUILDING NORTH PORTION MATTAPARAI - 624213
260,Sadaiyampatti,PANCHAYAT UNION MIDDLE SCHOOL SOUTH FACE NORTH BUILDING SADAIYAMPATTI - 624213
261,Ramarajapuram,PANCHAYAT UNION PRIMARY SCHOOL SOUTHERN SIDE BUILDING RAMARAJAPURAM - 624206
262,Ramarajapuram,PANCHAYAT UNION . PRIMARY SCHOOL NORTHERN SIDE BUILDING RAMARAJAPURAM - 624206
263,Meenachipuram,NEHRU AIDED PRIMARY SCHOOL SOUTH FACING ASBESTOS BUILDING MEENACHIPURAM - 624206
264,Ramarajapuram,GOVT KALLAR MIDDLE SCHOOL WEST FACING SOUTH SIDE NORTH BUILDING RAMARAJAPURAM - 624213
265,Ramarajapuram,GOVT KALLAR MIDDLE SCHOOL WEST FACING EAST BUILDING RAMARAJAPURAM 624213
