Polling Station No.,Building,Polling Areas
82,"P.U.M.School Kottarakudi, Southbuilding, East Facing","1.Kottarakkudi (R.V.) and (P) Rottu theru East Ward-1 , 2.Kottarakkudi (R.V.) and (P) Perusathangudi Sathiram Ward-2 , 3.Kottarakkudi (R.V.) and (P) Kondaman Thoppu Ward-1 , 4.Kottarakkudi (R.V.) and (P) Rottu Theru West Ward-1 , 5.Kottarakkudi (R.V.) and (P) Mill Street Ward 1 , 6.Kottarakkudi (R.V.) and (P) West Street Ward 1 , 7.Kottarakkudi (R.V.) and (P) Middle Street Ward 1 , 8.Kottarakkudi (R.V.) and (P) East Street Ward-1 , 9.Kottarakkudi (R.V.) and (P) Pallivasal Street Ward-1 , 10.Kottarakkudi (R.V.) and (P) Nallukkudi ward 2 , 11.Kottarakkudi (R.V.) and (P) Perikannamangalam Ward-2 , 99.OVERSEAS ELECTORS OVERSEAS ELECTORS"
83,"P.U.M.School Kottarakudi, Southbuilding, East Facing","1.Kottarakkudi (R.V.) and (P) Periyakannamangalam Adi dravidar Street Ward-2 , 2.Kottarakkudi (R.V.) and (P) River Bank Street Ward-2 , 3.Kottarakkudi (R.V.) and (P) Vellar Thoppu Ward-2 , 4.Kottarakkudi (R.V.) and (P) Kudiyana Street Ward-2 , 5.Kottarakkudi (R.V.) and (P) Ukkadai Ward-2 , 6.Kottarakkudi (R.V.) and (P) Chinnakannamangalam Adidraiivdar Street Ward-3 , 7.Kottarakkudi (R.V.) and (P) Chinnakannamangalam Kudiyana Street Ward-3 , 8.Kottarakkudi (R.V.) and (P) Perinjathankudi Ward-3 , 99.OVERSEAS ELECTORS OVERSEAS ELECTORS"
84,"Pachayat Union Middle School Kuttalam 609703, East Facing East Facing Terraced Building","1.Kuthalam (R.V.) and (P) Puzhavarnallur street ward-1 , 2.Kuthalam (R.V.) and (P) Iyyanar Kovil Street Ward-1 , 3.Kuthalam (R.V.) and (P) Kuthalam Kudiyana Street Ward-1 , 4.Kuthalam (R.V.) and (P) Kuthalam East Street Ward-2 , 5.Kuthalam (R.V.) and (P) Soppu Company Ward-2 , 6.Kuthalam (R.V.) and (P) Mandapa Medu Ward-2 , 99.OVERSEAS ELECTORS OVERSEAS ELECTORS"
85,"Panchayat Union Primary School West Side New Building South Facing, South Facing New Terraced Building, Kopurajapuram","1.Kuthalam (R.V.) and (P) River Bank Street Ward-2 , 2.Kuthalam (R.V.) and (P) River Bank Street Ward-2 , 3.Goburarajapuram (R.V.) and (P) Pandaha Salai Street Ward-2 , 4.Goburarajapuram (R.V.) and (P) Colony Street Ward-2 , 5.Goburarajapuram (R.V.) and (P) Sannasi Panagudi Kudiya Street Ward-1 , 6.Goburarajapuram (R.V.) and (P) Sannasi Panangudi Adidravidar Street Ward-1 , 7.Goburarajapuram (R.V.) and (P) Thalaiyari Street Ward-1 , 8.Goburarajapuram (R.V.) and (P) Vellapackam Kudiyana Street Ward-1 , 9.Goburarajapuram (R.V.) and (P) Madha kovil Street Ward-1 , 99.OVERSEAS ELECTORS OVERSEAS ELECTORS"
86,"Sri Rajeshwari Aided Ele School South Portion, West Facing, Panangudi","1.Panangudi (R.V.) and (P) Salai street ward-1 , 2.Panangudi (R.V.) and (P) Panangudi Kudiyana Street Ward-1 , 3.Panangudi (R.V.) and (P) Adidravidar Street Ward-1 , 4.Panangudi (R.V.) and (P) Karaimedu Ward-1 , 99.OVERSEAS ELECTORS OVERSEAS ELECTORS"
87,"Sri Rajeshwari Aided Ele School Panangudi 611 002, Eastern Side Building First Room from North West Facing","1.Panangudi (R.V.) and (P) Mudhaliyar Panangudi Ward-2 , 2.Panangudi (R.V.) and (P) Samathuvapuram Ward-2 , 3.Panangudi (R.V.) and (P) Vellar Thidal Ward-2 , 99.OVERSEAS ELECTORS OVERSEAS ELECTORS"
88,"Panchayat Union Elementary School Terraced Building South Facing, Melavanjure","1.Panangudi (R.V.) and (P) Vetrivazhkai ward-3 , 2.Panangudi (R.V.) and (P) Kovil Pathu Ward-3 , 3.Panangudi (R.V.) and (P) CPCL Kudiyiruppu Ward-3 , 4.Panangudi (R.V.) and (P) Iyyanar Kovil Street Ward-3 , 5.Panangudi (R.V.) and (P) Asari Street Ward-3 , 6.Panangudi (R.V.) and (P) Mill Street Ward-3 , 7.Panangudi (R.V.) and (P) Pudhumanai Street Ward-3 , 8.Panangudi (R.V.) and (P) Costums Colony Ward-3 , 9.Panangudi (R.V.) and (P) Karaikkal Main Road Ward-3 , 10.Panangudi (R.V.) and (P) Thittacheri Main Road Ward-3 , 99.OVERSEAS ELECTORS OVERSEAS ELECTORS"
89,"Panchayat Union Elementary School Terraced Building East Facing, Samathuvapuram Panangudi","1.Panangudi (R.V.) and (P) Odaimedu Ward-2 , 99.OVERSEAS ELECTORS OVERSEAS ELECTORS"
90,"Govt High School East Facing Building, Samathuvapuram Panangudi","1.Panangudi (R.V.) and (P) TEMPARVARY SHETER , 99.OVERSEAS ELECTORS OVERSEAS ELECTORS"
91,"Panchayat Union Elementary School Narimanam 611 002, West Facing Southern Side Building","1.Narimanam (R.V.) and (P) Sivan kovil street ward-1 , 2.Narimanam (R.V.) and (P) Perumal Kovil Street Ward-1 , 3.Narimanam (R.V.) and (P) Agraharam Ward-1 , 4.Narimanam (R.V.) and (P) East Street Ward-1 , 5.Narimanam (R.V.) and (P) West Street Ward-1 , 6.Narimanam (R.V.) and (P) North Street Ward-2 , 7.Narimanam (R.V.) and (P) Middle Street Ward-2 , 8.Narimanam (R.V.) and (P) Naranamangalam Ward-2 , 9.Narimanam (R.V.) and (P) Sullangkal Ward-2 , 99.OVERSEAS ELECTORS OVERSEAS ELECTORS"
92,"P.U.P.School Boothangudi Uthamachozhapuram 611 002, Terraced Building (South Facing) Southern Side","1.Uthamachozhapuram (R.V.) and (P) Poothangudi Thalaiyari Thoppu Ward 1 , 2.Uthamachozhapuram (R.V.) and (P) Poothangudi Kambar Street Ward 1 , 3.Uthamachozhapuram (R.V.) and (P) Poothangudi Devit Nagar Ward 1 , 4.Uthamachozhapuram (R.V.) and (P) Poothangudi Colony Street Ward 1 , 5.Uthamachozhapuram (R.V.) and (P) Poothangudi Madha Kovil Street Ward 1 , 6.Uthamachozhapuram (R.V.) and (P) Poothangudi Kudiyana Street Ward 1 , 7.Uthamachozhapuram (R.V.) and (P) Boothangudi Main Road Ward-1 , 8.Uthamachozhapuram (R.V.) and (P) Sirunangai Silicate Company Ward-1 , 9.Uthamachozhapuram (R.V.) and (P) Sirunangai Narimanam Salai Ward 1 , 10.Uthamachozhapuram (R.V.) and (P) Sirunangai Akilandapuram Annath theru Ward 3 , 99.OVERSEAS ELECTORS OVERSEAS ELECTORS"
93,"P.U.P.School Boothangudi Uthamacholapuram 611 002, Terraced Building (South Facing ) East Side","1.Uthamachozhapuram (R.V.) and (P) Sirunangai Akilandapuram Main Road Ward 3 , 2.Uthamachozhapuram (R.V.) and (P) Sirunangai Main Road Ward-2 , 3.Uthamachozhapuram (R.V.) and (P) Sirunangai Madha Kovil Street Ward 2 , 4.Uthamachozhapuram (R.V.) and (P) Sirunangai Pugazhendhi Street Ward 2 , 5.Uthamachozhapuram (R.V.) and (P) Sirunangai Main Road Ward 2 , 6.Uthamachozhapuram (R.V.) and (P) Sirunangai Kannaki Street Ward 2 , 99.OVERSEAS ELECTORS OVERSEAS ELECTORS"
94,"Government High School North Portion East Side RCC Building, South Facing Tiled Building, Muttam","1.Nagore (R.V) Muttam (P) North Street ward:1 , 2.Nagore (R.V) Muttam (P) Middle Street ward:1 , 3.Nagore (R.V) Muttam (P) Pillaiyar Koil Street ward:1 , 4.Nagore (R.V) Muttam (P) Keela Street ward:1 , 5.Nagore (R.V) Muttam (P) Keela-Athi Dravidar Street ward:1 , 6.Nagore (R.V) Muttam (P) Palani Thidal ward:2 , 7.Nagore (R.V) Muttam (P) Perumal Koil Street ward:2 , 8.Nagore (R.V) Muttam (P) South Street ward:2 , 9.Nagore (R.V) Muttam (P) Mela- Athi Dravidar Street ward:2 , 10.Nagore (R.V) Muttam (P) IBP Kudiruppu ward:2 , 11.Nagore (R.V) Muttam (p) North-Athi Dravidar Street ward:2 , 99.OVERSEAS ELECTORS OVERSEAS ELECTORS"
95,"National Higher Sec School RCC Building Western Side Room, Pidarai koil Street Nagore","1.Nagapattinam (M) Perumal-North Street ward:1 , 2.Nagapattinam (M) Vetrilaikaran Thiruvasal ward:1 , 3.Nagapattinam (M) Nadan-Pettai ward:1 , 4.Nagapattinam (M) Thumpapoo Mada Street ward:1 , 5.Nagapattinam (M) Kosamettu Street ward:1 , 6.Nagapattinam (M) Mela-Akragaram ward:1 , 99.OVERSEAS ELECTORS OVERSEAS ELECTORS"
96,"National Higher Sec School (West Side Room No.3 From East Building), Pidarai koil Street Nagore","1.Nagapattinam (M) Perumal-Mela Veethi ward:1 , 2.Nagapattinam (M) Nanayakara Street ward:1 , 3.Nagapattinam (M) Perumal Madavalakam ward:1 , 4.Nagapattinam (M) Perumal-Then Santhu ward:1 , 5.Nagapattinam (M) Peumal Koil Mela Mada Vilakam ward:1 , 6.Nagapattinam (M) Perumal Koil Kulam-Melakarai ward:1 , 7.Nagapattinam (M) Kosa Street ward:1 , 99.OVERSEAS ELECTORS OVERSEAS ELECTORS"
97,"National Elementary School West Side (RCC Building RoomNo :5), Perumal Keelaveethi Nagore","1.Nagapattinam (M) Thirumalaiyappan-Chandu ward:2 , 2.Nagapattinam (M) Perumal-Keela Veethi North Side ward:2 , 3.Nagapattinam (M) Perumal-South Street ward:2 , 4.Nagapattinam (M) Mappillai-Street ward:2 , 5.Nagapattinam (M) Kalikuttian-Nayakkar Street ward:2 , 6.Nagapattinam (M) Pidari Koil Street ward:2 , 7.Nagapattinam (M) Perumal Sannathi ward:2 , 8.Nagapattinam (M) Perumal-Keela Veethi ward:2 , 9.Nagapattinam (M) Alaukkaran Thottam ward:2 , 99.OVERSEAS ELECTORS OVERSEAS ELECTORS"
98,"National Elementary School RCC Building Room No 7, Perumal Keelaveethi Nagore","1.Nagapattinam (M) Vandi Pettai ward:2 , 2.Nagapattinam (M) Vannan Kulam- Vadakarai ward:2 , 3.Nagapattinam (M) Vannara Street ward:2 , 4.Nagapattinam (M) North-Vannara Street ward:2 , 5.Nagapattinam (M) Vannan Kulam-Melkarai ward:2 , 99.OVERSEAS ELECTORS OVERSEAS ELECTORS"
99,"Municipal Manikkam Chettiyar Elementary School (RCC Building Ground Floor North Side), Sivan Mela Veethy Nagore","1.Nagapattinam (M) Sivan North Street ward:3 , 2.Nagapattinam (M) Sivan Sannathi ward:3 , 3.Nagapattinam (M) Sivan Keela-Mada Vilakam ward:3 , 4.Nagapattinam (M) Sivan-South Mada Vilakam ward:3 , 5.Nagapattinam (M) Sivan-Mela Mada Vilagam ward:3 , 6.Nagapattinam (M) Sivan-South Street ward:3 , 99.OVERSEAS ELECTORS OVERSEAS ELECTORS"
100,"Municipal Manikkam Chettiyar Elementary School (RCC Building Ground Floor North Side East Side North Building), Sivan Mela Veethy Nagore","1.Nagapattinam (M) Sivan-Mela Veethi ward:3 , 2.Nagapattinam (M) Otha Kammala Street ward:3 , 3.Nagapattinam (M) Retta Kammala Street ward:3 , 4.Nagapattinam (M) Palaya Thoni Thurai Road ward:3 , 5.Nagapattinam (M) Kosa-Kula Street ward:3 , 6.Nagapattinam (M) Sivan-Keela Veethi ward:3 , 99.OVERSEAS ELECTORS OVERSEAS ELECTORS"
101,"Municipal Islam Middle School (RCC Building Western Side), Miya theru Nagore","1.Nagapattinam (M) Pandakasalai-1st-Street ward:4 , 2.Nagapattinam (M) Miyad- Street ward:4 , 3.Nagapattinam (M) Pandakasalai Street ward:4 , 4.Nagapattinam (M) Puliya Marathadi Chandu ward:8 , 5.Nagapattinam (M) Kattupalli-Kula Street ward:4 , 6.Nagapattinam (M) Kalpandakasalai Street ward:4 , 99.OVERSEAS ELECTORS OVERSEAS ELECTORS"
102,"Municipal Islam Middle School East Side RCC Building, Miyatheru Nagore","1.Nagapattinam (M) Miyad Street-1st Chandu ward:4 , 2.Nagapattinam (M) Mela Pattina Chery ward:4 , 99.OVERSEAS ELECTORS OVERSEAS ELECTORS"
103,"Palaniyandi Pillai Sathiram (Eastern Side Mangalore Tiled(Muslim) ), Railadi Street Nagore","1.Nagapattinam (M) Keelapattinacherry North Street ward:5 , 2.Nagapattinam (M) Keelapattinacherry-South Street ward:5 , 3.Nagapattinam (M) South Street ward 5 , 4.Nagapattinam (M) Melapattinacherry ward:5 , 99.OVERSEAS ELECTORS OVERSEAS ELECTORS"
104,"Palaniyandi Pillai Sattiram(Mangalure Tiled Building Eastern Side(Muslim) ), Nagore","1.Nagapattinam (M) Keelpattinachery ward:5 , 99.OVERSEAS ELECTORS OVERSEAS ELECTORS"
105,"Palaniyandi pillai chattiram (Mangalore Tiled Building Hindu Hall), Nagore","1.Nagapattinam (M) Maideen Palli Street ward:6 , 2.Nagapattinam (M) Maideen Palli- 11 Chandu ward:6 , 3.Nagapattinam (M) Maideen Palli-3 Chandu ward:6 , 4.Nagapattinam (M) Maideen Palli-4 Chadu ward:6 , 5.Nagapattinam (M) Maideen Palli-5 Chandu ward:6 , 6.Nagapattinam (M) Maideen Palli-10 Chandu ward:6 , 7.Nagapattinam (M) Maideen Palli 8 & 9 Chandu ward:6 , 8.Nagapattinam (M) Maideen Palli-7 Chandu ward:6 , 9.Nagapattinam (M) New Street ward:6 , 10.Nagapattinam (M) Thalimattu-Street ward:6 , 11.Nagapattinam (M) Maideen Palli- 1 Street ward:6 , 12.Nagapattinam (M) Maideen Palli-Male Chandu ward:6 , 99.OVERSEAS ELECTORS OVERSEAS ELECTORS"
106,"Municipal Islam Elementary School RCC Building North Side Room East Facing, Puliyamarathadi Santhu Nagore","1.Nagapattinam (M) Theru Palli-Street ward:6 , 2.Nagapattinam (M) Theru Palli Street-1Chandu ward:6 , 3.Nagapattinam (M) Theru Palli-Kulam Street ward:6 , 4.Nagapattinam (M) Maideen Palli-1 Chandu ward:7 , 5.Nagapattinam (M) Semmarakadai-Street ward:6 , 6.Nagapattinam (M) Sandha-Sahip Street ward:6 , 7.Nagapattinam (M) Manavara-North Street ward:6 , 8.Nagapattinam (M) Manavara- North Keel Mele Chandu ward:6 , 9.Nagapattinam (M) Manavara-West Street ward:8 , 10.Nagapattinam (M) Manavara-North Chandu ward:6 , 99.OVERSEAS ELECTORS OVERSEAS ELECTORS"
107,"Gowthiya Higher Secondary School(Northern Side Building Room:12), Thaikkal Street Nagore","1.Nagapattinam (M) Peerodum Street (Silladi Nagar) ward:7 , 2.Nagapattinam (M) South Street ward:7 , 99.OVERSEAS ELECTORS OVERSEAS ELECTORS"
108,"Gowthiya Higher Secondary School(Southern Side Building Room:12), Thaikkal Street Nagore","1.Nagapattinam (M) Sangu-Vetti Street ward:7 , 2.Nagapattinam (M) Poraiyatha- Kadai Theru ward:7 , 3.Nagapattinam (M) Beerodum Street ward:7 , 99.OVERSEAS ELECTORS OVERSEAS ELECTORS"
109,"Gowthiya Higher Secondary School(RCC Building Southern Side Room:12), Thaikkal Street Nagoor","1.Nagapattinam (M) Dharga Kulam Vadakarai ward:7 , 2.Nagapattinam (M) Yusibiya Nagar ward:7 , 3.Nagapattinam (M) Noolkadai Theru ward:7 , 4.Nagapattinam (M) Jadaiyar Street ward 7 , 99.OVERSEAS ELECTORS OVERSEAS ELECTORS"
110,"Gowthiya Higher Secondary School(RCC Building Southern Side Sponsered Building), Thaikkal Street Nagoor","1.Nagapattinam (M) Dharga Kulam-Melkarai ward:7 , 2.Nagapattinam (M) Dharga Kulam- Thankarai ward:7 , 3.Nagapattinam (M) Dharga Kulam-Keelkarai ward:7 , 4.Nagapattinam (M) Kaleeba Sahib Street ward:7 , 5.Nagapattinam (M) Kaliba Sahib- 1 Chandu ward:7 , 6.Nagapattinam (M) Kaliba Sahib-2 Chandu ward:7 , 7.Nagapattinam (M) Siyamaraikayar Street ward:7 , 99.OVERSEAS ELECTORS OVERSEAS ELECTORS"
111,"Municipal Islam Elementary School RCC Building South Side Room East Facing, Puliyamarathadi Sandhu Nagore","1.Nagapattinam (M) Manavara Chandu ward:8 , 2.Nagapattinam (M) Kunjali- Maraikayar Chandu ward:8 , 3.Nagapattinam (M) Kosa-Maraikayar Street ward:8 , 4.Nagapattinam (M) Makadoomsa-Street ward:8 , 5.Nagapattinam (M) Theradi- Chandu ward:8 , 6.Nagapattinam (M) Periya-Kadai Theru ward:8 , 7.Nagapattinam (M) Manavara-South Street ward:8 , 8.Nagapattinam (M) Malimiyar-1Chandu ward:8 , 99.OVERSEAS ELECTORS OVERSEAS ELECTORS"
112,"Gowthiya Primary School (Mangaloure Tiled Building Eastern Side ), South Street Nagore","1.Nagapattinam (M) Theradi Subbu-Chetty Chandu ward:8 , 2.Nagapattinam (M) Alanta-Marathadi Chandu ward:8 , 3.Nagapattinam (M) Valayal Kadai Theru ward:8 , 4.Nagapattinm (M) Nellu Kadai-Street ward:8 , 5.Nagapattinam (M) Malumiyar Street (4 Chandu) ward:8 , 6.Nagapattinam (M) Yanaikatti-Mutukku ward:8 , 7.Nagapattinam (M) Manavara-1 Chandu ward:8 , 8.Nagapattinam (M) Manavara-2 Chandu ward:8 , 9.Nagapattinam (M) Manavara-3 Chandu ward:8 , 10.Nagapattinam (M) Kalmattu-Street ward:8 , 11.Nagapattinam (M) Kalmattu Street-1 Chandu ward:8 , 12.Nagapattinam (M) Seyadu Palli Kula Theru ward:8 , 13.Nagapattinam (M) Malumiyar Middle street ward:8 , 99.OVERSEAS ELECTORS OVERSEAS ELECTORS"
113,"National Elementary School( RCC Building Eastern Side Room No:1), Perumal Keelaveethi Nagore","1.Nagapattinam (M) Public Road ward:9 , 2.Nagapattinam (M) Mariyamman Koil Chandu ward:9 , 99.OVERSEAS ELECTORS OVERSEAS ELECTORS"
114,"National Primary School ( RCC Building Western Side Room:3), Perumal Keelaveethi Nagore","1.Nagapattinam (M) Kolla Street ward:9 , 2.Nagapattinam (M) Kolla Street North Chandu ward:9 , 3.Nagapattinam (M) Thankachi Mada Chandu ward:9 , 4.Nagapattinam (M) Kadar Moideen Thottam ward:9 , 5.Nagapattinam (M) Kadarsha Maraikayar Chandu ward:9 , 6.Nagapattinam (M) Venkittu Chandu ward:9 , 7.Nagapattinam (M) Pampatti Chandu ward:9 , 8.Nagapattinam (M) Vanakkara Street Nagore ward:9 , 99.OVERSEAS ELECTORS OVERSEAS ELECTORS"
115,"Gowthiya Elementary School (Mangalore Tiled Building Northern Side Room Western Wing), South Street Nagore","1.Nagapattinam (M) Pudumanai Street ward:10 , 2.Nagapattinam (M) Pudumani- Street Raice Mill Chandu ward:10 , 3.Nagapattinam (M) Puthumanai Street-1vathu chandhu ward:10 , 99.OVERSEAS ELECTORS OVERSEAS ELECTORS"
116,"Gowthiya Primary School Mangalore Tiled Building, North Room East Portion South Street Nagoor","1.Nagapattinam (M) Koiyaka-Ahmed Neina Chandu ward:10 , 2.Nagapattinam (M) Samuthambi-Maraikayar Street ward:10 , 3.Nagapattinam (M) Beerodum Kattu Raouthar Thottam ward:10 , 4.Nagapattinam (M) Ambedkar Nagar ward:10 , 5.Nagapattinam (M) Kalara Shet ward:10 , 6.Nagapattinam (M) Kasappu Thottam ward:10 , 7.Nagapattinam (M) Peerodum Street ward:10 , 99.OVERSEAS ELECTORS OVERSEAS ELECTORS"
117,"Gowthiya Primary School Mangalore Tiled Building South Side Room, South Street Nagore","1.Nagapattinam (M) Mudukku-Thazha Chandu west ward:10 , 99.OVERSEAS ELECTORS OVERSEAS ELECTORS"
118,"Gowthiya Primary School Mangalore Tiled Building West Side, South Street Nagore","1.Nagapattinam (M) Mudukku-Thazha Chandu east ward:10 , 99.OVERSEAS ELECTORS OVERSEAS ELECTORS"
119,"Municipal Elementary School (RCC Building Southern Side), Mariyamman koil Steet South Palpannaichery","1.Nagapattinam (M) North Palpannaicheri mala Street ward:11 , 2.Nagapattinam(M) North Palpannaicheri Keela Theru ward:11 , 3.Nagapattinam (M) Mariyamman Koil- Sannathi ward:11 , 99.OVERSEAS ELECTORS OVERSEAS ELECTORS"
120,"Municipal Elementary School (RCC Building North Side), Mariyamman koil Steet South Palpannaichery","1.Nagapattinam (M) North Palpannaicheri North Sandu ward:11 , 2.Nagapattinam (M) North Palpannicheri Nadar Street ward:11 , 3.Nagapattinam (M) Velayutham- Street ward:11 , 4.Nagapattinam (M) Vellarikai mandapam ward:11 , 5.Nagapattinam (M) Thethi-New Road ward:11 , 6.Nagapattinam (M) G.S.Pillai College Road ward:11 , 7.Nagapattinam (M) Water Tank-Back Side ward:11 , 99.OVERSEAS ELECTORS OVERSEAS ELECTORS"
121,"Municipal Primary School(RCC Building Northern Side ), Mariamman Sannathi South Palppannaichery","1.Nagapattinam (M) Kattutheru North Palpannachery ward 11 , 2.Nagapattinam (M) South palpannai Cherry Pillaiyar Koil Street ward:11 , 3.Nagapattinam (M) North palpannai Cheery Main Road ward:11 , 4.Nagapattinam (M) South Palpannai Cherry ward:11 , 5.Nagapattinam (M) Main Road South Palpannai Cherry ward:11 , 6.Nagapattinam (M) Sivasakthi Nagar ward:11 , 7.Nagapattinam (M) Tsunami Temporary Shelther ITI Camp Valakam ward:11 , 99.OVERSEAS ELECTORS OVERSEAS ELECTORS"
122,"Municipal Primary School(RCC Building Northern Side ), Palppannaichery","1.Nagapattinam (M) Lakshmi Nagar ward:11 , 99.OVERSEAS ELECTORS OVERSEAS ELECTORS"
123,"Municipal Middle School (RCC Building ), Samanthankuppam","1.Nagapattinam (M) Samanthan Kuppam ward:11 , 99.OVERSEAS ELECTORS OVERSEAS ELECTORS"
124,"Municipal Midddle School (RCC Building Middle Side), Kadambadi Nagapattinam","1.Nagapattinam (M) Pachai Pillaiyar Koil Keel Mele Street ward:12 , 2.Nagapattinam (M) Mohamadiyar Street-11Street ward:12 , 99.OVERSEAS ELECTORS OVERSEAS ELECTORS"
125,"Municipal Midddle School (RCC Building Middle Room North Facing), Kadambadi Nagapattinam","1.Nagapattinam (M) Thiroupathaiyamman-Koil Street ward:12 , 2.Nagapattinam (M) Souriyar Koil Street ward:12 , 3.Nagapattinam (M) Kavara Street ward:12 , 99.OVERSEAS ELECTORS OVERSEAS ELECTORS"
126,"Municipal Middle School New RCC Building East Side, Kadambadi Nagapattinam","1.Nagapattinam (M) Mariyamman Koil Street ward:12 , 2.Nagapattinam (M) Vadakudi Sathiram ward:12 , 3.Nagapattinam (M) Nadar Street ward:12 , 99.OVERSEAS ELECTORS OVERSEAS ELECTORS"
127,"Municipal Middle School New RCC Building West Side, Kadambadi Nagapattinam","1.Nagapattinam (M) Public Office Road ward:12 , 2.Nagapattinam (M) N.g.o.Colony ward:12 , 3.Nagapattinam (M) ward:12 Tsunami-Temprari Shet DRO Bungalow , 99.OVERSEAS ELECTORS OVERSEAS ELECTORS"
128,"Municipal Middle School (New RCC Building Northern Side ), Kadambadi Nagapattinam","1.Nagapattinam (M) Kadambadi Pillayar Koil Street ward:13 , 2.Nagapattinam (M) Kadambadi Sebastiyar Koil Street ward:13 , 3.Nagapattinam (M) Bungalow Club Road ward:13 , 99.OVERSEAS ELECTORS OVERSEAS ELECTORS"
129,"Municipal Middle School (New RCC Building Eastern Side), Kadambadi Nagapattinam","1.Nagapattinam (M) Police Colony ward:13 , 2.Nagapattinam (M) Sir Ahmed Villa North ward:13 , 3.Nagapattinam (M) Elanseran Nagar ward:13 , 4.Nagapattinam (M) Neidal Nagar ward:13 , 99.OVERSEAS ELECTORS OVERSEAS ELECTORS"
130,"Municipal Middle School(Southern Side RCC Building ), Nambiyarnagar Velippalayam Nagapattinam","1.Nagapattinam (M) Newbeachroad ward:13 , 2.Nagapattinam (M) Panchayat Union- Officers Colony ward:13 , 3.Nagapattinam (M) Kollai Kattu Street ward:13 , 4.Nagapattinam (M) Port Offisers Colony ward:13 , 5.Nagapattinam (M) Kadambadi Nambiyar Nagar Road ward:13 , 6.Nagapattinam (M) Housing Board Colony ward:13 , 7.Nagapattinam (M) Nambiyar Nagar Road Then Sandu ward:13 , 8.Nagapattinam (M) Nambiyar Nagar Road North Road ward:13 , 9.Nagapattinam (M) Maraimalai Nagar 1-Street ward:13 , 10.Nagapattinam (M) Maraimalai Nagar 2-Street ward:13 , 11.Nagapattinam (M) Maraimalai Nagar 3-Street ward:13 , 12.Nagapattinam (M) Maraimalai Nagar 4-Street ward:13 , 13.Nagapattinam (M) Maraimalai Nagar 5-Street ward:13 , 14.Nagapattinam (M) Maraimalai Nagar 6-Street ward:13 , 15.Nagapattinam (M) West Salai ward:13 , 16.Nagapattinam (M) Maraimalai Nagar 9- Street ward:13 , 17.Nagapattinam (M) Maraimalai Nagar 8-Street ward:13 , 18.Nagapattinam (M) Maraimalai Nagar 7-Street ward:13 , 99.OVERSEAS ELECTORS OVERSEAS ELECTORS"
131,"Municipal Middle School Nambiyar Nagar Velipalayam Nagapattinam, South Facing Northern Side","1.Nagapattinam (M) Nambiyar Nagar Colony ward:14 , 2.Nagapattinam (M) Meenavar Colony Nambiyar Nagar ward:14 , 3.Nagapattinam (M) Nambiyar Nagar Middle Street ward:14 , 4.Nagapattinam (M) South Street Nambiyar Nagar ward:14 , 5.Nagapattinam (M) North Street Nambiyar Nagar ward:14 , 6.Nagapattinam (M) East Street Nambiyar Nagar ward:14 , 99.OVERSEAS ELECTORS OVERSEAS ELECTORS"
132,"Municipal Middle School Nambiyar Nagar Velipalayam Nagapattinam, West Facing Eastern Side","1.Nagapattinam (M) Nambiyar Nagar Meenavar Colony ward:14 , 2.Nagapattinam (M) Middle Street Nambiyar Nagar ward:14 , 3.Nagapattinam (M) Nambiyar Nagar Main Road ward:14 , 99.OVERSEAS ELECTORS OVERSEAS ELECTORS"
133,"Municipal Middle School (RCC New Building North Side East Facing ), Nambiyar Nagar Nagapattinam","1.Nagapattinam (M) Railway Line East Side ward:14 , 2.Nagapattinam (M) Nambiyar Nagar East ward:14 , 99.OVERSEAS ELECTORS OVERSEAS ELECTORS"
134,"Municipal Middle School North Side (RCC New Building West Portion), Nambiyar Nagar Nagapattinam","1.Nagapattinam (M) Tsunami Temporary Shelters Nambiyar Nagar ward:14 , 2.Nagapattinam (M) Nambiyar Nagar west ward:14 , 99.OVERSEAS ELECTORS OVERSEAS ELECTORS"
135,"Municipal Middle School New RCC South Building, Nellukkadai Street Velippalayam Nagapattinam","1.Nagapattinam (M) Kariyangudi Chetti Street ward:15 , 2.Nagapattinam (M) Mariyamman Koil Street ward:15 , 3.Nagapattinam (M) Nellukadai-Street ward:15 , 99.OVERSEAS ELECTORS OVERSEAS ELECTORS"
136,"Municipal Middle School RCC Building, Nellukkadai Street Velippalayam Nagapattinam","1.Nagapattinam (M) Kaliyamman Koil Street Back Side ward:15 , 2.Nagapattinam (M) Rama Nayakkan Kula Theru ward:15 , 3.Nagapattinam (M) Mariyamman Mela Veethi ward:15 , 4.Nagapattinam (M) Mariyamman Koil Melamada Vilakam ward:15 , 5.Nagapattinam (M) Mariyamman Keela Mada Vilagam ward:15 , 6.Nagapattinam (M) Kaliamman Kovil Street ward:15 , 7.Nagapattinam (M) Muthu Mariyamman North Street ward:15 , 99.OVERSEAS ELECTORS OVERSEAS ELECTORS"
137,"Natarajan Dhamayanthi Primary School (Southern Side RCC Building Western Side 2nd Room), Sivan West Street Velippalayam Nagapattinam","1.Nagapattinam (M) Sivan Chetti Street ward:16 , 2.Nagapattinam (M) Sivan Vadakku Veethi ward:16 , 3.Nagapattinam (M) Mariyamman Therku Veethi ward:16 , 4.Nagapattinam (M) Athi Dhiravidar Street ward:16 , 5.Nagapattinam (M) Melavaikkangarai Street ward:16 , 6.Nagapattinam (M) Sivan-South Street ward:16 , 7.Nagapattinam (M) Sivasakthi Nagar ward:16 , 99.OVERSEAS ELECTORS OVERSEAS ELECTORS"
138,"Natarajan Dhamayanthi Primary School (Southern Side East Last Portion, North Facing), Sivan West Street Velippalayam Nagapattinam","1.Nagapattinam (M) Sivan Mela Veethi ward:16 , 2.Nagapattinam (M) Ramamada North Street ward:16 , 3.Nagapattinam (M) Sivan-Mela Mada Vilakam ward:16 , 4.Nagapattinam (M) Thirukkulam Mel Sandhu ward:16 , 5.Nagapattinam (M) Aanandhavalli Amman Sannathi ward:16 , 6.Nagapattinam(m) Neela Sandhu ward:16 , 7.Nagapattinam (M) Thirukkulam Vadakarai ward:16 , 8.Nagapattinam (M) Ramarmadam North Street ward:16 , 9.Nagapattinam (M) Sivan Therku Madavilagam ward:16 , 10.Nagapattinam (M) Sivan Vadakku Madavilagam ward:16 , 99.OVERSEAS ELECTORS OVERSEAS ELECTORS"
139,"Natarajan Dhamayanthi Elementary School (Southern Side RCC Building West Side 2nd Room), Sivanmelaveethi Velippalayam Nagapattinam","1.Nagapattinam (M) Anna Nagar ward:16 , 2.Nagapattinam (M) Sivan-Keelaveethi ward:16 , 3.Nagapattinam (M) Ponna Pillai Street ward:16 , 4.Nagapattinam (M) Thamothara Nayudu Street ward:16 , 5.Nagapattinam (M) Ramarmada Street ward:16 , 6.Nagapattinam (M) Chinnappa Muthaliyar Street ward:16 , 7.Nagapattinam (M) Sankara Vinayagar Street ward:16 , 8.Nagapattinam (M) Sankara Vinayagar Keezh Sandhu ward:16 , 9.Nagapattinam (M) Sankara Vinayagar Mel Sandhu ward:16 , 10.Nagapattinam (M) Sivan Sannathi ward:16 , 11.Nagapattinam (M) Akastheeswaran Swami Thoppu ward:16 , 12.Nagapattinam (M) Vaikkangarai Street ward:16 , 13.Nagapattinam (M) Ramarmada Keezh Sandhu ward:16 , 14.Nagapattinam (M) Tsunami Temporary Shelters - Nanthavanam ward:16 , 99.OVERSEAS ELECTORS OVERSEAS ELECTORS"
