Polling Station No.,Building,Polling Areas
140,"Natarajan Dhamayanthi High School(Southern Side RCC Building West Portion , Nandu Kulam Road Velippalayam Nagapattinam","1.Nagapattinam (M) Public Office Road ward:17 , 2.Nagapattinam (M) Kuppachi Thottam ward:17 , 3.Nagapattinam (M) Kamarajar Colony ward:17 , 4.Nagapattinam (M) Vappakandu Maraikkarayar Thottam ward:17 , 5.Nagapattinam (M) Railwaygate Melpakkam ward:17 , 6.Nagapattinam (M) Kumaran Nagar Velivai ward:17 , 7.Nagapattinam (M) Nandu Kulam Road ward:17 , 8.Nagapattinam (M) Railway Line Sandhu ward:17 , 9.Nagapattinam (M) Naga Thoppu ward:17 , 10.Nagapattinam (M) Fire Service Officer Colony ward:17 , 99.OVERSEAS ELECTORS OVERSEAS ELECTORS"
141,"Nadarajan Dhamayanthi High School (Southern Side RCC Building Eastern Portion), Nanddukulam Road Velippalayam Nagapattinam","1.Nagapattinam (M) Municiple Pettai,ward:17 , 2.Nagapattinam (M) Ealai Pillaiyar Koil Street Ward:17 , 3.Nagapattinam (M) Ramanayakkan Kulam Vadakarai Ward:17 , 4.Nagapattinam (M) Vandi Pettai Ward:17 , 99.OVERSEAS ELECTORS OVERSEAS ELECTORS"
142,"Nadarajan Dhamayanthi High School (Southern Side West Center Portion), Nanddukulam Road Velippalayam Nagapattinam","1.Nagapattinam (M) Chetti Thottam Hookes Road Ward:17 , 2.Nagapattinam(m) Hookes Nagar Ward:17 , 99.OVERSEAS ELECTORS OVERSEAS ELECTORS"
143,"Municipal Elementary School (Southern Side New RCC Building ), Vedanayagam Chetty Street Nagapattinam","1.Nagapattinam (M) Railway Gate Melpuram South North Sandu ward:18 , 2.Nagapattinam (M) Andhoniyar Kovil Then Sandhu ward:18 , 3.Nagapattinam (M) Vedhanayagam Chetti Street 3-Sandu ward:18 , 4.Nagapattinam (M) Vedanayakam Chett Street 4-Sandu ward:18 , 5.Nagapattinam (M) Vedhanayagam Street 6-Sandhu ward:18 , 6.Nagapattinam (M) Vedhanayagam Street 5-Sandhu ward:18 , 99.OVERSEAS ELECTORS OVERSEAS ELECTORS"
144,"Municipal Elementary School (North Side New RCC Building) , Vedanayagam Chetty Street Nagapattinam","1.Nagapattinam (M) Vedhanayagam Street 7-Sandhu ward:18 , 2.Nagapattinam (M) Vedhanayagam Street 8-Sandhu ward:18 , 3.Nagapattinam (M) Vedhanayagam Chetti Street ward:18 , 4.Nagapattinam (M) Vedhanayagam Chetti Street 1-Sandhu ward:18 , 5.Nagapattinam (M) Vedanayagam Chetti Street 2-Sandu ward:18 , 99.OVERSEAS ELECTORS OVERSEAS ELECTORS"
145,"Municipal Elementary School (Southern Side RCC Building Eastern Portion), Vedanayagam Chetty Street Nagapattinam","1.Nagapattinam (M) North Nalliyan Thottam ward:18 , 2.Nagapattinam (M) Hospital Road ward:18 , 99.OVERSEAS ELECTORS OVERSEAS ELECTORS"
146,"Municipal Elementary School (Southern Side RCC Building Eastern Portion South Room), Vedanayagam Chetty Street Nagapattinam","1.Nagapattinam(p) Hookes Road ward:18 , 2.Nagapattinam (M) Vadakku Kottaivasal Keel Road ward:18 , 3.Nagapattinam (M) South Street Nalliyan Thottam ward:18 , 4.Nagapattinam (M) Koodaimudaivore Colony ward:17 , 99.OVERSEAS ELECTORS OVERSEAS ELECTORS"
147,"Municipal Elementary School RCC Building South Side North Facing Building, Sir Agamad Street Nagapattinam","1.Nagapattinam (M) Market South Side ward:19 , 2.Nagapattinam (M) Market Melpuram ward:19 , 3.Nagapattinam (M) Ariyapathira Pillai Theru ward:19 , 4.Nagapattinam (M) Tharma Koil Sannathi ward:19 , 99.OVERSEAS ELECTORS OVERSEAS ELECTORS"
148,"Municipal Elementary School South Portion North Side RCC Building, Sir Agamad Street Nagapattinam","1.Nagapattinam (M) Tharma Koil Road ward:19 , 2.Nagapattinam (M) Public Office Road ward:19 , 99.OVERSEAS ELECTORS OVERSEAS ELECTORS"
149,"Saint Anthony Higher Secontary School (Western Side RCC Building RoomNo: 12 ), V O C Street Nagapattinam","1.Nagapattinam (M) Perumal Vadakku Sandhu ward:20 , 2.Nagapattinam (M) Perumal Thenmada Vilagam ward:20 , 3.Nagapattinam (M) Perumal Sannathi ward:20 , 4.Nagapattinam (M) Perumal Keezh Sandhu ward:20 , 5.Nagapattinam (M) Suppa Muthaliyar Street ward:20 , 6.Nagapattinam (M) Sivan-South Street ward:20 , 7.Nagapattinam (M) Perumal Mela Vadampokki ward:20 , 8.Nagapattinam (M) Veerikulam Keel Sandhu ward:20 , 9.Nagapattinam (M) Veerikulam Sandhu ward:20 , 10.Nagapattinam (M) Veerikulam Then Karai ward:20 , 11.Nagapattinam (M) Perumal-Keela Veethi ward:20 , 99.OVERSEAS ELECTORS OVERSEAS ELECTORS"
150,"Saint Antonys Higher Secontary School(Western Side RCC Building RoomNo: 9), V O C Street Nagapattinam","1.Nagapattinam (M) Sivan Sannathi South ward:20 , 2.Nagapattinam (M) Thamarai Kulam Melkarai ward:20 , 3.Nagapattinam (M) Perumal Vadakku Veethi ward:20 , 4.Nagapattinam (M) Perumal North Street ward:20 , 5.Nagapattinam (M) Salavai Kulam Doctor Street ward:20 , 6.Nagapattinam (M) Salavai Kulam Muhamathiyar Street ward:20 , 7.Nagapattinam (M) Nadukkam Theertha Pillaiyar-Sannathi ward:20 , 99.OVERSEAS ELECTORS OVERSEAS ELECTORS"
151,"Saint Antonys Higher Secontary School(Western Side RCC Building RommNo:6), V O C Street Nagapattinam","1.Nagapattinam (M) Public Road ward:21 , 2.Nagapattinam (M) Thamaraikulam Thenkarai ward:21 , 99.OVERSEAS ELECTORS OVERSEAS ELECTORS"
152,"Saint Antonys Higher Secontary School(West Facing East Side Building Room No 8), V O C Street Nagapattinam","1.Nagapattinam (M) Ganapathiya Pillai Thottam ward:21 , 2.Nagapattinam (M) Madundhukothalam Kmmala Street ward:21 , 3.Nagapattinam (M) Poundu Thottam ward:21 , 4.Nagapattinam (M) Kappalottiya Chidhambaram Pillai Street ward:21 , 5.Nagapattinam (M) Servai Thottam ward:21 , 99.OVERSEAS ELECTORS OVERSEAS ELECTORS"
153,"Municipal Middle School (Western Side RCC Building), Kallukara Street Nagapattinam","1.Nagapattinam (M) Subbaiyah Pillai Sandhu & Erulappa Pillai Sandu ward:22 , 2.Nagapattinam (M) Kottuppalaya Street ward:22 , 3.Nagapattinam (M) Kottupalaiya Kittangiyamman Thottam ward:22 , 4.Nagapattinam (M) Ramarmadam Middle Sandhu ward:22 , 5.Nagapattinam (M) Kittangiyamman Sannathi ward:22 , 6.Nagapattinam (M) Kinattradi Sandhu ward:22 , 7.Nagapattinam (M) Manikkampillai Sandhu ward:22 , 8.Nagapattinam (M) Kaliyapillai Sandhu ward:22 , 99.OVERSEAS ELECTORS OVERSEAS ELECTORS"
154,"Municipal Middle School (East Side South Room West Facing), Kallukara Street Nagapattinam","1.Nagapattinam (M) Kadasalkkara Street ward:22 , 2.Nagapattinam (M) Ramarmadam Sandhu ward:22 , 3.Nagapattinam (M) Kathan Chetti Street ward:22 , 4.Nagapattinam (M) Kallukkara Street ward:22 , 5.Nagapattinam (M) Ayyanaar Sannathi ward:22 , 99.OVERSEAS ELECTORS OVERSEAS ELECTORS"
155,"Municipal Muslim Elementary School (Asbestos Sheet Building Northern Side), New Street Nagapattinam","1.Nagapattinam (M) Sir Ahamad Street ward:23 , 2.Nagapattinam (M) Pudhu Street ward:23 , 3.Nagapattinam (M) Semmarakkadai Then Sandhu ward:23 , 4.Nagapattinam (M) Karaiyan Pillaiyar Koil Sekkadi Mudukku ward:23 , 5.Nagapattinam (M) Karaiyan Pillaiyar Then Sandu ward:25 , 99.OVERSEAS ELECTORS OVERSEAS ELECTORS"
156,"Municipal Muslim Elementary School (Asbestos Sheet Building Southern Side ), New Street Nagapattinam","1.Nagapattinam (M) New Street 1st Sandhu ward:23 , 2.Nagapattinam (M) Andhonoyar Koil Mel Sandhu ward:23 , 3.Nagapattinam (M) Nagutha Appavu Chetti Sandhu ward:23 , 4.Nagapattinam (M) Semmarakkadai Keel Sandhu ward:23 , 5.Nagapattinam (M) Andhoniyar Kovil Street ward:23 , 6.Nagapattinam (M) Semmarakkadai North Sandhu ward:23 , 7.Nagapattinam (M) Semmarakkadai Mel Sandhu ward:23 , 8.Nagapattinam (M) New Street 2nd Sandhu ward:23 , 99.OVERSEAS ELECTORS OVERSEAS ELECTORS"
157,"Saint Antony Elemetary School North Side RCC Building South Facing Room No:2, North Kottaivasal Keel Road Nagapattinam","1.Nagapattinam (M) Ariyanattutheru 12th Sandhu ward:24 , 2.Nagapattinam (M) Ariyanattutheru 11th Sandhu ward:24 , 3.Nagapattinam (M) Ariyanattutheru 9th Sandhu ward:24 , 4.Nagapattinam (M) Ariyanattutheru 8th Sandhu ward:24 , 5.Nagapattinam (M) Ariyanattutheru 6th Sandhu ward:24 , 6.Nagapattinam (M) Ariyanattutheru 5th Sandhu ward:24 , 7.Nagapattinam (M) Ariyanattutheru 4th Sandhu ward:24 , 99.OVERSEAS ELECTORS OVERSEAS ELECTORS"
158,"Saint Antony Elemetary School South Side RCC Building East Facing Room No:1, North Kottaivasal Keel Road Nagapattinam","1.Nagapattinam (M) Maravadith Street Ward:24 , 2.Nagapattinam (M) Aariyanattutheru 1Sandu Ward:24 , 99.OVERSEAS ELECTORS OVERSEAS ELECTORS"
159,"Municipal Girls Higher Secontary School (Southern Side RCC Building North side Building), Neela South Street Nagapattinam","1.Nagapattinam (M) Vengayakkadai Street ward:25 , 2.Nagapattinam (M) Thattan Kinattradi Sandhu ward:25 , 3.Nagapattinam (M) Beach Road ward:25 , 4.Nagapattinam (M) Pinpandaka Salai Street ward:25 , 5.Nagapattinam (M) Noolkadai Street ward:25 , 99.OVERSEAS ELECTORS OVERSEAS ELECTORS"
160,"Municipal Girls Higher Secontary School (Western Side East Facing Building), Neela South Street Nagapattinam","1.Nagapattinam (M) Katheebu Leppai Street ward:25 , 2.Nagapattinam (M) kannara Street ward:25 , 3.Nagapattinam (M) Andhikkadai Mudukku ward:25 , 99.OVERSEAS ELECTORS OVERSEAS ELECTORS"
161,"Municipal Girls Higher Secontary School Northern Side RCC Building South Facing Room No:2, Neela South Street Nagapattinam","1.Nagapattinam (M) Malai Easwaran Sannathi ward:26 , 2.Nagapattinam (M) Devaiyyar Street ward:26 , 3.Nagapattinam (M) Kandiappar Thirukula Mudukku ward:26 , 4.Nagapattinam (M) Neela South Mada Vilagam ward:26 , 5.Nagapattinam (M) Neela Melamada Vilagam ward:26 , 6.Nagapattinam (M) Neela Keelamada Vilagam ward:26 , 7.Nagapattinam (M) Neela Sannathi ward:26 , 99.OVERSEAS ELECTORS OVERSEAS ELECTORS"
162,"Municipal Girls Higher Secontary School Northern Side RCC Building West Facing Room No:2, Neela South Street Nagapattinam","1.Nagapattinam (M) Neela Keela Veethi ward:26 , 2.Nagapattinam (M) Neela Vadakku Veethi ward:26 , 3.Nagapattinam (M) Theevattikaran Sandhu ward:26 , 4.Nagapattinam (M) Pundareeha Kulam Vadakarai ward:26 , 5.Nagapattinam (M) Neela Mela Veethi ward:26 , 6.Nagapattinam (M) Pidari Kovil Street ward:26 , 99.OVERSEAS ELECTORS OVERSEAS ELECTORS"
163,"Municipal Girls Higher Secontary School Northern Side RCC Building South Facing Room No:3, Neela South Street Nagapattinam","1.Nagapattinam (M) Kaya Rohana Sannathi ward:27 , 2.Nagapattinam (M) Atchu Narayana Pillai Sandhu ward:27 , 3.Nagapattinam (M) Sattaiappar Keelamada Vilagam ward:27 , 4.Nagapattinam (M) Sattaiappar South Mada Vilagam ward:27 , 5.Nagapattinam (M) Naganathar Mela Veethi ward:27 , 6.Nagapattinam (M) Sattaiappar Melamada Vilagam ward:27 , 7.Nagapattinam (M) Sattaiappar North Mada Vilagam ward:27 , 8.Nagapattinam (M) Tharumapura Madatheru ward:27 , 9.Nagapattinam (M) Neela Mela Vadampokki ward:27 , 10.Nagapattinam (M) Thandavaraya Pillai North Sandhu ward:27 , 11.Nagapattinam (M) Naganathar Thatcha Street ward:27 , 99.OVERSEAS ELECTORS OVERSEAS ELECTORS"
164,"Municipal Girls Higher Secontary School West Side RCC Building Room No:10, Neela South Street Nagapattinam","1.Nagapattinam (M) Thandavaraya Pillai Street ward:27 , 2.Nagapattinam (M) Marundhu Kottalam Kaliamman koil Sannathi ward:27 , 3.Nagapattinam (M) Marunthu Kothalam Kaliyamman Sannathi Back Side ward:27 , 4.Nagapattinam (M) Naganathar Sannathi ward:27 , 5.Nagapattinam (M) Sattaiappar Vadakku Veethi ward:27 , 99.OVERSEAS ELECTORS OVERSEAS ELECTORS"
165,"Municipal Girls Higher Secontary School Northern Side RCC Building East Side Room South Facing Room No:6, Neela South Street Nagapattinam","1.Nagapattinam (M) Puthu Palli Street ward:25 , 2.Nagapattinam (M) Sala Palli Street ward:25 , 3.Nagapattinam (M) Karaiyan Pillaiyar Street ward:25 , 4.Nagapattinam (M) Motcha Palli Street ward:25 , 5.Nagapattinam (M) Karaiyan Pillaiyar Then Sandhu ward:25 , 6.Nagapattinam (M) Karaiyan Pillaiyar Koil,Naniyammal Thottam ward:25 , 99.OVERSEAS ELECTORS OVERSEAS ELECTORS"
166,"Municipal Elementary School Eastern Side RCC Building South Facing, Marunthukotthalam Kaliyammankoil Street Nagapattinam","1.Nagapattinam (M) Thiroupathiamman Sannathi ward:28 , 2.Nagapattinam (M) Athithiravidar Street ward:28 , 3.Nagapattinam (M) Thotti Sreett Sekkadi Thotti Street ward:28 , 4.Nagapattinam (M) Ottar Street ward:28 , 5.Nagapattinam (M) Sunnambu Kalavai Street ward:28 , 99.OVERSEAS ELECTORS OVERSEAS ELECTORS"
167,"Municipal Elementary School West Side RCC Building, Marunthukotthalam Kaliyamman koil Street Nagapattinam","1.Nagapattinam (M) Marundhu Kothalam Road ward:28 , 2.Nagapattinam (M) Marunthu Kottalam Road Thoolkidangu 1st Sandhu ward:28 , 3.Nagapattinam (M) Marunthu Kothalam Road Tholekidanku 2-st Sandu ward:28 , 4.Nagapattinam (M) Marunthu Kothalam Road Kodimara Sandhu ward:28 , 5.Nagapattinam (M) Kattunayakkar Street ward:28 , 6.Nagapattinam (M) Thiroupathiamman Vadapuram Sunnampu Kalvai Street ward:28 , 99.OVERSEAS ELECTORS OVERSEAS ELECTORS"
168,"C S I Primary School (Western Side RCC Building ), Alagar Melaveethi Nagapattinam","1.Nagapattinam (M) Akkarai Kulam Vadakarai ward:29 , 2.Nagapattinam (M) Mela Kottai Vasal ward:29 , 3.Nagapattinam (M) Akkarai Kulam Melkarai ward:29 , 4.Nagapattinam (M) Akkarai Kulam Keel Karai ward:29 , 5.Nagapattinam (M) Akkarai Kulam Thenkarai ward:29 , 99.OVERSEAS ELECTORS OVERSEAS ELECTORS"
169,"C S I Primary School (Western Side RCC Building ), Alagar Melaveethi Nagapattinam","1.Nagapattinam (M) Velankanni Road ward:29 , 2.Nagapattinam (M) Kanjapuli Athi Dravidar Street ward:29 , 3.Nagapattinam (M) Natarajar Street ward:29 , 4.Nagapattinam (M) Akkarai Kulam North Road ward:29 , 99.OVERSEAS ELECTORS OVERSEAS ELECTORS"
170,"C S I High School (Western Side RCC Building), Alagar Melaveethi Nagapattinam","1.Nagapattinam (M) Mankottaisami Kovil ward:30 , 2.Nagapattinam (M) Paravaikkara Street ward:30 , 3.Nagapattinam (M) Sattaiappar Mela Veethi ward:30 , 4.Nagapattinam (M) Puliyamarathadi Street ward:30 , 5.Nagapattinam (M) Attaikkulam Vadakarai ward:30 , 99.OVERSEAS ELECTORS OVERSEAS ELECTORS"
171,"C S I High School Western Side South Last Room, Alagar Melaveethi Nagapattinam","1.Nagapattinam (M) Puliyamarathu Theradi Street ward:30 , 2.Nagapattinam (M) Puliya Marathikodi 1st Sandhu ward:30 , 3.Nagapattinam (M) Puliya Marathikodi 3st Sandhu ward:30 , 4.Nagapattinam (M) Attaikkulam ward:30 , 5.Nagapattinam (M) Puliyamarathadi 2st Sandhu ward:30 , 6.Nagapattinam (M) Karpaga Vinayagar Sannathi ward:30 , 7.Nagapattinam (M) Perambukkara Street ward:30 , 99.OVERSEAS ELECTORS OVERSEAS ELECTORS"
172,"EGS Pillai Nursury and Primary School, Perumal Keela Mada Vilagam, Ground Floor, North Side Class Room Nagapattinam","1.Nagapattinam (M) Perumal-Mela Veethi ward:30 , 2.Nagapattinam (M) Saandha Pillai Sandhu ward:31 , 3.Nagapattinam (M) Perumal Therku Mada Vilagam ward:31 , 4.Nagapattinam (M) Perumal Vadakku Mada Vilagam ward:31 , 5.Nagapattinam (M) Pattunoolkkara Theru ward:31 , 6.Nagapattinam (M) Tharmapura Then Sandhu ward:31 , 7.Nagapattinam (M) Bali Beeda Street ward:31 , 8.Nagapattinam (M) Markkanda Chetti Street ward:31 , 9.Nagapattinam (M) Sattaiappar Therku Veethi ward:31 , 10.Nagapattinam (M) Sattaiappar Therku Sannathi ward:31 , 11.Nagapattinam (M) Attaikkula Street ward:30 , 12.Nagapattinam (M) Perumal- South Street ward:31 , 13.Nagapattinam (M) Perumal Mela Mada Vilagam ward:31 , 99.OVERSEAS ELECTORS OVERSEAS ELECTORS"
173,"National Higher Secontary School (RCC Building Room No:7 ), Neela South Street Nagapattinam","1.Nagapattinam (M) Eruthukkara Then Sandhu ward:32 , 2.Nagapattinam (M) Eruthukkara Street ward:32 , 3.Nagapattinam (M) Naduvar Keela Veethi ward:32 , 4.Nagapattinam (M) Naduvar Sannathi Theru ward:32 , 5.Nagapattinam (M) Naduvar Therku Mada Vilagam ward:32 , 6.Nagapattinam (M) Neela Therku Veethi ward:32 , 7.Nagapattinam (M) Sattaiappar Keela Veethi ward:32 , 8.Nagapattinam (M) Nanayakkara Street ward:32 , 9.Nagapattinam (M) Malai Eswaran Vadakku Veethi , 10.Nagapattinam (M) Malai Eswaran Mada Vilagam ward:32 , 11.Nagapattinam (M) Kumaran Vadakku Sandhu ward:32 , 12.Nagapattinam (M) Kattiappar Sannathi ward:32 , 13.Nagapattinam (M) Kattiappar Vadakku Sandhu ward:26 , 99.OVERSEAS ELECTORS OVERSEAS ELECTORS"
174,"EGS Pillai Nursury and Primary School, Perumal Keela Mada Vilagam, Ground Floor, North Side Middle Class Room Nagapattinam","1.Nagapattinam (M) Vaanakkara Keel Sandhu ward:33 , 2.Nagapattinam (M) Perumal Keela Veethi ward:33 , 3.Nagapattinam (M) Azhagar Mela Veethi ward:33 , 4.Nagapattinam (M) Perumal-North Street ward:33 , 5.Nagapattinam (M) Yathav Street ward:33 , 6.Nagapattinam (M) Azhagar Melamada Vilagam ward:33 , 7.Nagapattinam (M) Nathaji Street ward:33 , 8.Nagapattinam (M) Azhagar Keela Veethi ward:33 , 9.Nagapattinam (M) Kothaan Kulam Vadakarai ward:33 , 10.Nagapattinam (M) Kothaan Kulam Melkarai ward:33 , 99.OVERSEAS ELECTORS OVERSEAS ELECTORS"
175,"EGS Pillai Nursury and Primary School, Perumal Keela Mada Vilagam, Ground Floor, South Side Class Room Nagapattinam","1.Nagapattinam (M) Nethaji Road ward:33 , 2.Nagapattinam (M) Mariyamman Sannathi ward:33 , 3.Nagapattinam (M) Thirumeni Chetti Street ward:33 , 4.Nagapattinam (M) Veerapathira Swami Koil Street ward:33 , 5.Nagapattinam (M) Yanikutti-Muukku ward:33 , 6.Nagapattinam (M) Perumal Keela Mada Vilagam ward:33 , 7.Nagapattinam (M) Azhagar Sannathi Nagai ward:33 , 8.Nagapattinam (M) Perumal Sannathi ward:33 , 9.Nagapattinam (M) Kothaan Kulam Keelkarai ward:33 , 99.OVERSEAS ELECTORS OVERSEAS ELECTORS"
176,"Ilagiya Nursery and Primary School North Facing RCC Building Room No:2, Aliya Maraikayar Street Nagapattinam","1.Nagapattinam (M) Pazhantheru 2nd Sadhu ward:34 , 2.Nagapattinam (M) Pazhantheru 3rd Sadhu ward:34 , 3.Nagapattinam (M) Pazhantheru 4th Sadhu ward:34 , 4.Nagapattinam (M) Kamaliya Sandhu ward:34 , 5.Nagapattinam (M) Kamaliya Then Sandhu ward:34 , 6.Nagapattinam (M) Yathava Then Sandhu ward:34 , 7.Nagapattinam (M) Yathava Vadukku Sandhu ward:34 , 8.Nagapattinam (M) Pin Pandaka Salai Street ward:34 , 9.Nagapattinam (M) Dutchu Market Sandhu ward:34 , 10.Nagapattinam (M) Billukkadai Street ward:34 , 11.Nagapattinam (M) Kamaliya Masoothi Street ward:34 , 12.Nagapattinam (M) Bakkeer Appa Sandhu ward:34 , 13.Nagapattinam (M) Pazhan Theru 1nd Sadhu ward:34 , 14.Nagapattinam (M) Yahusain Palli Street ward:34 , 15.Nagapattinam (M) Aliya Maraikayar Street ward:34 , 16.Nagapattinam (M) Johnson Sandhu ward:34 , 17.Nagapattinam (M) Johnson Street ward:34 , 18.Nagapattinam (M) Koopar Street ward:34 , 99.OVERSEAS ELECTORS OVERSEAS ELECTORS"
177,"Municipal Elementary School Southern Side Rcc Building North Facing, Kottaimettu Street Nagapattinam","1.Nagapattinam (M) Thoniyhurai Road south ward:35 , 99.OVERSEAS ELECTORS OVERSEAS ELECTORS"
178,"Municipal Elementary School South Side Rcc Building West Side, Kottaimettu Street Nagapattinam","1.Nagapattinam (M) Thoniyhurai Road north ward:35 , 99.OVERSEAS ELECTORS OVERSEAS ELECTORS"
179,"Municipal Elementary School South Facing South North Side RCC Center Building, KottaimettuStreet Nagapattinam","1.Nagapattinam (M) Uppalam Road ward:35 , 99.OVERSEAS ELECTORS OVERSEAS ELECTORS"
180,"Municipal Elementary School North Facing South North Side RCC Center Building, KottaimettuStreet Nagapattinam","1.Nagapattinam (M) Tsunami Temp Shelter Sevai ward:35 , 2.Nagapattinam (M) Tsunami Temp Shelter Kandeepan Global Fo ward:35 , 99.OVERSEAS ELECTORS OVERSEAS ELECTORS"
181,"Municipal Elementary School (Northern Side Aspestos Building ), Kottaimettu Street Nagapattinam","1.Nagapattinam (M) Raliway Colony ward:36 , 2.Nagapattinam (M) Murthappa Settiyar Thottam ward:35 , 3.Nagapattinam (M) South North Sandhu ward:35 , 4.Nagapattinam (m) Palaniyappa Kalapadiyar Keel Mela Sandu ward:35 , 5.Nagapattinam (M) Udaiyar Thottam 1st Sandhu ward:35 , 6.Nagapattinam (M) Udaiyar Thottam Meltheru ward:35 , 7.Nagapattinam (M) Thandapani Chettiyar Thottam ward:35 , 8.Nagapattinam (M) Thandabani Chettiyar Thottam 2nd Sandhu ward:35 , 9.Nagapattinam (M) Thandapani Chettiyar Thottam ward:35 , 10.Nagapattinam (M) Kottaimattu Keel Mela Street ward:35 , 11.Nagapattinam (M) Railway Than Vada Santhu ward:35 , 12.Nagapattinam (M) Udaiyar Thottam ward:35 , 13.Nagapattinam (M) Kottai Mattu Street ward:35 , 14.Nagapattinam (M) Mathersha Ravuthar Thottam ward:35 , 15.Nagapattinam (M) Kalappadiyar Thottam ward:35 , 16.Nagapattinam (M) Railway Station Road ward:35 , 17.Nagapattinam (M) I.S.R.Keel Mela Road ward:35 , 18.Nagapattinam (M) Railway Commpound North ward:36 , 19.Nagapattinam (M) Collage Road ward:36 , 99.OVERSEAS ELECTORS OVERSEAS ELECTORS"
182,"Municipal Elementary School (Southern Side RCC Building ), Geeraikollai Street Nagapattinam","1.Nagapattinam (M) Semmatti Pillaiyar Sannathi ward:36 , 2.Nagapattinam (M) Thiruvangadathan Pallai Street ward:36 , 3.Nagapattinam (M) Veppillai Kaliamman Street ward:36 , 4.Nagapattinam (M) Sekkadi Mudukku ward:36 , 5.Nagapattinam (M) Semmatti Pillaiyar Kovil Street ward:36 , 6.Nagapattinam (M) Railway Station South Keel Mela Street ward:36 , 7.Nagapattinam (M) Keeraikollai Street 1st Sandhu , 8.Nagapattinam (M) Keeraikollai Stret 2nd Sandhu ward:36 , 9.Nagapattinam (M) Kottaimettu Thenvadal Sandhu ward:36 , 10.Nagapattinam (M) Railway Gate Vadapuram ward:36 , 11.Nagapattinam (M) Kottaimattu Street ward:35 , 99.OVERSEAS ELECTORS OVERSEAS ELECTORS"
183,"Municipal Elementary School (Northern Side Aspestos Building ), Keeraikollai Street Nagapattinam","1.Nagapattinam (M) Keerai Kollai Street 2nd Sandhu ward:36 , 2.Nagapattinam (M) Keerai Kollai Street ward:36 , 3.Nagapattinam (M) Sekkadi Street ward:36 , 4.Nagapattinam (M) Seenan Kollai 3rd Street ward:36 , 5.Nagapattinam (M) Keeraikollai KeelMel Street ward:36 , 6.Nagapattinam (M) Keerai Kollai Street 1st Sandhu ward:36 , 7.Nagapattinam (M) Keeraikollai Street 3rd Sandhu ward:36 , 8.Nagapattinam (M) Josap Sandhu ward:36 , 9.Nagapattinam (M) Keerakolla Street Keela Mela Street ward:36 , 10.Nagapattinam (M) Uppanar Athi Dravidar Street ward:36 , 11.Nagapattinam (M) Uppanar Keela Mela Road ward:36 , 99.OVERSEAS ELECTORS OVERSEAS ELECTORS"
184,"Thiruvalluvar Aided Elementary School Country Tiled Building, R.C.C Building, Vadakudi","1.Vadakudi (R.V) And (P) Sivan Sanathi ward:1 , 2.Vadakudi (R.V) And (P) Therku Veethi ward:1 , 3.Vadakudi (R.V) And (P) Vadakku Street ward:1 , 4.Vadakudi (R.V) And (P) Pillai Street ward:1 , 5.Vadakudi (R.V) And (P) Jeeva Street ward:1 , 6.Vadakudi (R.V) And (P) Thoppu Street ward:1 , 7.Vadakudi (R.V) And (P) Mariyamman Kovil Street ward:1 , 8.Vadakudi (R.V) And (P) Vp-Seinthan Street ward:1 , 9.Vadakudi (R.V) And (P) Mela Street ward:1&2 , 10.Vadakudi (R.V) And (P) Palakadu Main Road ward:2 , 11.Vadakudi (R.V) And (P) Paguthayam ward:2 , 12.Vadakudi (R.V) And (P) Palakadu North Street ward:2 , 13.Vadakudi (R.V) And (P) Palakadu Middle Street ward:2 , 14.Vadakudi (R.V) And (P) Palakadu South Street ward:2 , 15.Vadakudi (R.V) And (P) Poneenveli ward:2 , 99.OVERSEAS ELECTORS OVERSEAS ELECTORS"
185,"Panchayat Union Elementary School RCC Building South Portion, South Facing RCC Building, Thethi","1.Thethei (R.V) And (P) Keela Street ward:1 , 2.Thethei (R.V) And (P) Mala Nagore ward:1 , 3.Theithei (R.V) And (P) North Street ward:3 , 4.Theithei (R.V) And (P) Mela Street ward:3 , 99.OVERSEAS ELECTORS OVERSEAS ELECTORS"
186,"Panchayat Union Elementary School RCC Building West Facing, West Facing R.C.C Building, Thethi","1.Theithei (R.V) And (P) Sivan Sanathi ward:3 , 2.Theithei (R.V) And (P) South street ward:3 , 3.Theithei (R.V) And (P) Tharumar Nagar ward:3 , 99.OVERSEAS ELECTORS OVERSEAS ELECTORS"
187,"Panchayat Union Elementary School RCC Building North Facing, West Facing R.C.C Building, Thethi","1.Thetthi (R.V) And (P) Tsunami shelters -2 world vision , 99.OVERSEAS ELECTORS OVERSEAS ELECTORS"
188,"Government High School Perungadambanur North Side Building West Side South Facing, West Facing R.C.C Building, Perungadambanur","1.Perunkadambanur (R.V) And (P) Milladisanthu-(pillayarkovil) ward:1 , 2.Perunkadambanur (R.V) And (P) Pillayar Kovil Street Ward:1 , 3.Perunkadambanur (R.V ) And (P) Jeeva Street ward 1 , 4.Perunkadambanur (R.V ) And (P) Mariyaman Kovil Street ward 1 , 5.Perunkadambanur (R.V) And (P) Sivan Kovil Street Ward:1 , 6.Perunkadambanur (R.V) And (P) Chittivinayakar-Street ward:1 , 7.Perunkadambanur (R.V) And (P) Puthiya Colony Street Ward :1 , 8.Elangadampanur (R.V) Perungadambanur (P) Vellalar North Street ward:2 , 99.OVERSEAS ELECTORS OVERSEAS ELECTORS"
189,"Government High School Perungadambanur North Side Building East Side South Facing, South Facing R.C.C Building, Perungadambanur","1.Elangadampanur (R.V) Perungadambanur (P) Malaveli ward:2 , 2.Elangadampanur (R.V) Perungadambanur (P) Keelaveli ward:2 , 3.Elangadampanur (R.V) Peurngadambanur (P) Vairaneirupu-New Street ward:2 , 4.Elangadampanur (R.V) Perungadambanur (P) Vairaneirupu Palakattu Roattu Theru ward:2 , 5.Elangadampanur (R.V) Perungadambanur (P) Vairaneirupu Vadakudi Roattu Theru ward:2 , 6.Elangadampanur (R.V) Perungadambanur (P) Puleiyan Thopu ward:2 , 7.Elangadampanur (R.V) Perungadambanur (P) Milladei Street ward:2 , 8.Elangadampanur (R.V) Perungadambanur (P) Elakadampanur ward:2 , 99.OVERSEAS ELECTORS OVERSEAS ELECTORS"
