Polling Station No.,Building,Polling Areas
267,"N.P.S.S Rathina Nadar Kanagammal Rotary Matric.Hr.Sec.School North Building, KPAT Dharmaraj Nadar Rojapoothaiammal Block, North Side Building, 2nd Room from East, Viswanatham.","Viswanatham (R.V), Viswanatham (P) Ward 1 Naduvur"
268,"P.U. Primary School North West Corner Building, Facing East, 1st Room from South, Viswanatham","Viswanatham (R.V), Viswanatham (p) Ward 2 Viswanatham Pudur South St., Middle St., North St., OPR Nagar & Devangar Nagar"
269,"P.U. Primary School North West Corner Building, 2nd Room From South, Facing East, Viswanatham","Viswanatham (R.V), Viswanatham (p) Ward 2 Kavitha Nagar, Kamaraj Nagar, Indira Nagar, Kaka Colony & Kammavar Colony"
270,"P.U Primary School North Building, Facing South, 1st Room from West,Viswanatham","Viswanatham (R.V), Viswanatham (p) Ward 2 Kaka Colony, OPR Nagar & Vishwanatham Pudur"
271,"P.U Primary School North Building, Facing South , 2nd Room from West, Viswanatham","Viswanatham (R.V), Viswanatham (p) Ward 2 Vinayagar Colony, Kamaraj Nagar, Kamarajapuram, Kavitha Nagar, Deivanai Nagar & Chinnathambi Nagar Kavitha Nagar"
272,"Govt. Hr. Sec..School New Building, Facing North, West Portion, Viswanatham","Viswanatham (R.V), Viswanatham (p) Ward 2 Viswanatham"
273,"Govt. Hr. Sec..School New Building, Facing North, East Portion, Viswanatham","Viswanatham (R.V), Viswanatham (p) Ward 2 Viswanatham"
274,"Govt. Hr. Sec..School SSA New Building, facing north Viswanatham","Viswanatham (R.V), Viswanatham (p) Kammavar Colony Devangar Nagar , Vinayagar Colony"
275,"Govt. Hr. Sec..School Additional Building, 1st Room from South Corner, Viswanatham","Viswanatham (R.V), Viswanatham (p) Indra Nagar North"
276,"Govt. Hr. Sec..School East Portion, 2nd Room form North, Facing West,Viswanatham","Viswanatham (R.V), Viswanatham (p) Kamarajar Nagar"
