Polling Station No.,Building,Polling Areas
228,"Ultra College Of Parmacy Reception Hall, ,East Building, South Gate, College Road, Tahsildar Nagar, Madurai - 625020.","1.Madurai (C) Vandiyur Main Road Ward 30,, 2.Madurai (C) Mariyamman Kovil Street Ward 30, 3.Madurai (C) Raja Veedhi Ward 30 , 4.Madurai (C) Malligai Street Ward 30, 5.Madurai (C) Vinayagar Kovil Street Main Street Ward 30, 99.OVERSEAS ELECTORS OVERSEAS ELECTORS"
229,"Reeta Nursery and Primary School, ,Eastern Portion, North Side 5/498 Thiruvalluvar Street, Sadhasiva Nagar, Madurai-625020.","1.Madurai (C) Thiruvalluvar Street Sadasiva Nagar Ward 31 , 2.Madurai (C) Thiruvalluvar Cross Street Ward 31, 3.Madurai (C) Subathra Street Sadasiva Nagar Ward 31 , 4.Madurai (C) Subathra Cross Street Sadasiva Nagar Ward 31, 5.Madurai (C) Annai Abirami Street Sadasiva Nagar Ward 31 , 6.Madurai (C) Pandian Street Sadasiva Nagar Ward 31, 7.Madurai (C) Meenakshi Street Sadasiva Nagar Ward 31, 8.Madurai (C) Sadhasiva Nagar Main Road Ward 31, 9.Madurai (C) Elangovadigal Cross Street Sadasiva Nagar Ward 31, 10.Madurai (C) Elangovadigal Street Sadasiva Nagar Ward 31 , 11.Madurai (C) Vinayagar Main Road Sadasiva Nagar Ward 31, 12.Madurai (C) Vinayagar Main 1st Street Sada Siva Nagar Ward 31 , 99.OVERSEAS ELECTORS OVERSEAS ELECTORS"
230,"FesFelicia Matric School (Annai School),,RCC Building, Salai Street, Gomathipuram 6th Street,Madurai- 625020.","1.Madurai (C) Nethaji Street Ward 31 , 2.Madurai (C) Nakeerar Street Ward 31, 3.Madurai (C) Kambar Street Ward 31, 4.Madurai (C) C S R Veethi Ward 31 , 5.Madurai (C) Vinayakar Kovil Street Ward 5, 6.Madurai (C) Sourastrapuram 13th Street Ward 31, 99.OVERSEAS ELECTORS OVERSEAS ELECTORS"
231,"Fuscos Matriculation Hr.Sec.School, ,Teacher Room, Yagappa Nagar- 625020.","1.Madurai (C) Kabilar Veethi Ward 31, 2.Madurai (C) Maraimalai Adikal Street Ward 31, 3.Madurai (C) Sekkilar Street Ward 31, 4.Madurai (C) Owvaiyar Street Ward 31 , 5.Madurai (C) Karumari Amman Street Ward 31, 6.Madurai (C) M G R Veedhi Ward 31, 7.Madurai (C) Vaigai Veedhi Ward 31, 99.OVERSEAS ELECTORS OVERSEAS ELECTORS"
232,"Fuscos Matriculation Hr.Sec.School,,Room no 3, Yagappa Nagar-625020.","1.Madurai (C) Pasumpon Street Ward 31, 2.Madurai (C) Balaji 1st Street Ward 31, 3.Madurai (C) Balaji 2nd Street Ward 31, 4.Madurai (C) Balaji Nagar Main Veethi Ward 31, 5.Madurai (C) Balaji Nagar 3rd Street Ward 31 , 6.Madurai (C) Balaji Nagar 4th Street Ward 31, 7.Madurai (C) Yagappa Nagar Main Road Ward 31 , 99.OVERSEAS ELECTORS OVERSEAS ELECTORS"
233,"Fuscos Matriculation Hr.Sec.School,,East Building, West Portion, Room No.1 Yagappa Nagar- 625020.","1.Madurai (C) Yagappa Nagar Selvavinayagar Kovil Street Ward 31 , 2.Madurai (C) Yagappa Nagar Abbas Street Ward 31, 99.OVERSEAS ELECTORS OVERSEAS ELECTORS"
234,"Fuscos Matriculation Hr.Sec.School,,East Building, West Portion, Room No. 2, Yagappa Nagar- 625020.","1.Madurai (C) Yagappa Nagar Pandian Nagar Ward 31, 99.OVERSEAS ELECTORS OVERSEAS ELECTORS"
235,"Fascos Matriculation Hr.Sec.School,,10th A Sec, Yagappa Nagar, Madurai-625020","1.Madurai (C) Balaji Nagar, Maharajan Street Ward 31, 2.Madurai (C) Vilangudi (SP) Kannadasan Street Ward 31, 3.Madurai (C) Kalaivanar Street Ward 31, 4.Madurai (C) Kurunji Nagar 9th Street Ward 31, 5.Madurai (C) Sourashtrapuram, Kurunji Nagar 9th Street Ward 31, 6.Madurai (C) Sourashtrapuram Kurunji Nagar 8th Street Ward 31, 7.Madurai (C) Sourashtrapuram Kurunji Nagar 7th Street Ward 31, 8.Madurai (C) Seyon Nagar Ward 31, 99.OVERSEAS ELECTORS OVERSEAS ELECTORS"
236,"Fascos Matriculation Hr.Sec.School,,12th Class Room, Yagappa Nagar, Madurai-625020.","1.Madurai (C) Kurinji Nagar 6th Street Ward 31, 2.Madurai (C) Kurunji Nagar 5th Street Ward 31, 3.Madurai (C) Kurunji Nagar 4th Street Ward 31 , 4.Madurai (C) Kurunji Nagar 3rd Street Ward 31, 5.Madurai (C) Kurunji Nagar 2nd Street Ward 31, 6.Madurai (C) Kurunji Nagar 1st Street Ward 31, 7.Madurai (C) Kurunji Nagar Main Road Ward 31, 99.OVERSEAS ELECTORS OVERSEAS ELECTORS"
